A212_13-000	Jarl Priel	Jarl Priel	# ʒarl 'pri.jɛl #	1	1	0	session_2/text/documents/A1-05_Antho_breton_3_texts_-_03_GWELL_BEZAN_MAB_KRIZ_EGET_BELEG_FALL.txt
A212_13-001	Gwell bezañ mab kriz eget beleg fall	Gwell bezañ mab kriz eget beleg fall	# gwɛl 'be.zɑ̃ mɑ:p kri:z 'eg.et 'bɛ.lɛk fal #	1	1	0	session_2/text/documents/A1-05_Antho_breton_3_texts_-_03_GWELL_BEZAN_MAB_KRIZ_EGET_BELEG_FALL.txt
A212_13-002	pajenn unan	p. 1	# 'pɑ.ʒɛn 'y.nɑ̃n #	1	1	0	session_2/text/documents/A1-05_Antho_breton_3_texts_-_03_GWELL_BEZAN_MAB_KRIZ_EGET_BELEG_FALL.txt
A212_13-003-00	Ur sul d'abardaez ,	Ur sul d’abardaez, 	# œr sy:l da.bar.'da.ɛs #	1	1	0	session_2/text/documents/A1-05_Antho_breton_3_texts_-_03_GWELL_BEZAN_MAB_KRIZ_EGET_BELEG_FALL.txt
A212_13-003-01	ur pennadig goude gouel an Holl-Sent , e teuas va zad d'ar c'hloerdi ,	ur pennadig goude gouel an Holl-Sent, e teuas va zad d’ar c’hloerdi, 	# œr pɛ.'nɑ.dig 'gu.de gwe:l ɑ̃n 'ɔl.sɛnt # e 'tø.az va zɑd dar 'xlwɛr.di #	1	1	0	session_2/text/documents/A1-05_Antho_breton_3_texts_-_03_GWELL_BEZAN_MAB_KRIZ_EGET_BELEG_FALL.txt
A212_13-003-02	ha souezhet e oan gantañ rak ne oa ket gwell-domm dezhañ an deiz-se .	ha souezhet e oan gantañ rak ne oa ket gwell-domm dezhañ an deiz-se. 	# a 'swe.zɛd e wɑ̃:n 'gɑ̃n.tɑ̃ rag ne wa ket 'gwɛl.dõm 'de.zɑ̃ ɑ̃n 'dɛjz.se #	1	1	0	session_2/text/documents/A1-05_Antho_breton_3_texts_-_03_GWELL_BEZAN_MAB_KRIZ_EGET_BELEG_FALL.txt
A212_13-003-03	Bet e oa , emezañ , o vale bete Priel , ha reiñ a reas din un tamm arc'hant a-berzh an « hini-gozh » .	Bet e oa, emezañ, o vale bete Priel ha reiñ a reas din un tamm arc’hant a-berzh an « hini-gozh ». 	# bed e wa # e.'me.zɑ̃ # o 'vɑ.le 'be.te 'pri.jɛl # a rɛj a 're.as din œn tɑ̃m 'arx.ɑ̃nd 'a.bɛrz ɑ̃n # hi.'nig.os #	1	1	0	session_2/text/documents/A1-05_Antho_breton_3_texts_-_03_GWELL_BEZAN_MAB_KRIZ_EGET_BELEG_FALL.txt
A212_13-003-04	Komz a rejomp evel boaz diwar-benn va studi ,	Komz a rejomp evel boaz diwar-benn va studi, 	# kõmz a 're.ʒõmb 'e.vɛl bwɑ:s di.'war.bɛn va 'sty.di #	1	1	0	session_2/text/documents/A1-05_Antho_breton_3_texts_-_03_GWELL_BEZAN_MAB_KRIZ_EGET_BELEG_FALL.txt
A212_13-003-05	va yec'hed , e labour e ti ar mezeg ,	va yec’hed, e labour e ti ar mezeg, 	# va 'jeh.ɛt # e 'lɑ.bur e ti: ar 'me.zɛk #	1	1	0	session_2/text/documents/A1-05_Antho_breton_3_texts_-_03_GWELL_BEZAN_MAB_KRIZ_EGET_BELEG_FALL.txt
A212_13-003-06	ha d'an ampoent-se e stagas kloc'hig ar chapel da dintal :	ha d’an ampoent-se e stagas kloc’hig ar chapel da dintal : 	# a dɑ̃n ɑ̃m.'po.ɛn.se e 'stɑg.as 'klɔh.ig ar 'ʃa.pɛl dɑ 'din.tal #	1	1	0	session_2/text/documents/A1-05_Antho_breton_3_texts_-_03_GWELL_BEZAN_MAB_KRIZ_EGET_BELEG_FALL.txt
A212_13-003-07	« Kenavo 'ta ,	« Kenavo ‘ta, 	# tɑ #	1	1	0	session_2/text/documents/A1-05_Antho_breton_3_texts_-_03_GWELL_BEZAN_MAB_KRIZ_EGET_BELEG_FALL.txt
A212_13-003-08	emezon , rak bremaik e vo bennozh ar Sakramant » .	emezon, rak bremaik e vo bennozh ar Sakramant ». 	# e.'me.zõn # rag 'bre.majg e vo 'bɛ.noz ar sa.'krɑ̃.mɑ̃nt #	1	1	0	session_2/text/documents/A1-05_Antho_breton_3_texts_-_03_GWELL_BEZAN_MAB_KRIZ_EGET_BELEG_FALL.txt
A212_13-003-09	Ha p'edo o kimiadiñ diouzhin , setu ma c'houlennas :	Ha p’edo o kimiadiñ diouzhin, setu ma c’houlennas : 	# a 'pe.do o ki.'mjɑ.di di.'u.zin # 'se.ty ma xu.'lɛ.nas #	1	1	0	session_2/text/documents/A1-05_Antho_breton_3_texts_-_03_GWELL_BEZAN_MAB_KRIZ_EGET_BELEG_FALL.txt
A212_13-003-10	« Ac'han 'ta , e sell out bepred da vont da Sant-Brieg ?	« Ac’han ‘ta, e sell out bepred da vont da Sant-Brieg ? - 	# tɑ # e sɛl ut 'be.pret dɑ võn dɑ sɑ̃n.'bri.ɛk #	1	1	0	session_2/text/documents/A1-05_Antho_breton_3_texts_-_03_GWELL_BEZAN_MAB_KRIZ_EGET_BELEG_FALL.txt
A212_13-003-11	- Ha d'ober petra , va zad ?	Ha d’ober petra, va zad ? 	# a 'do.bɛr 'pe.tra # va zɑt #	1	1	0	session_2/text/documents/A1-05_Antho_breton_3_texts_-_03_GWELL_BEZAN_MAB_KRIZ_EGET_BELEG_FALL.txt
A212_13-003-12	- Nom de va ene !	- Nom de va ene ! 	# nõm de va 'e.ne #	1	1	0	session_2/text/documents/A1-05_Antho_breton_3_texts_-_03_GWELL_BEZAN_MAB_KRIZ_EGET_BELEG_FALL.txt
A212_13-003-13	ha petra 'reer er c'hloerdi bras ? »	ha petra ‘reer er c’hloerdi bras ? » 	# a 're.ɛr er 'xlwɛr.di brɑ:s #	1	1	0	session_2/text/documents/A1-05_Antho_breton_3_texts_-_03_GWELL_BEZAN_MAB_KRIZ_EGET_BELEG_FALL.txt
A212_13-003-14	En gortoz e oan pell 'oa , da glevout kement-mañ ,	En gortoz e oan pell ‘oa da glevout kement-mañ, 	# en 'gɔr.tɔz e wɑ̃:n wa # dɑ 'gle.vut 'ke.mɛn.mɑ̃ #	1	1	0	session_2/text/documents/A1-05_Antho_breton_3_texts_-_03_GWELL_BEZAN_MAB_KRIZ_EGET_BELEG_FALL.txt
A212_13-003-15	ha ken pell all am boa graet va meno da stourm ouzh n'eus forzh piv a grogje gant ar gaoz-se ,	ha ken pell all am boa graet va meno da stourm ouzh n’eus forzh piv a grogje gant ar gaoz-se, 	# a ken pɛl al ɑ̃m 'bo.a grɛ:t va 'me.no dɑ sturm us nøs fɔrs piw a 'grɔgʃ.e gɑ̃n ar 'gɔz.se #	1	1	0	session_2/text/documents/A1-05_Antho_breton_3_texts_-_03_GWELL_BEZAN_MAB_KRIZ_EGET_BELEG_FALL.txt
A212_13-003-16	ha kaer en devefe aliañ ,	ha kaer en devefe aliañ, 	# a kɛ:r en de.'ve.fe a.'li.ɑ̃ #	1	1	0	session_2/text/documents/A1-05_Antho_breton_3_texts_-_03_GWELL_BEZAN_MAB_KRIZ_EGET_BELEG_FALL.txt
A212_13-003-17	arguziñ , pediñ pe vallozhiñ ,	arguziñ, pediñ pe vallozhiñ, 	# arg.'y.zi # 'pe.di pe va.'lo.zi #	1	1	0	session_2/text/documents/A1-05_Antho_breton_3_texts_-_03_GWELL_BEZAN_MAB_KRIZ_EGET_BELEG_FALL.txt
A212_13-003-18	lakaet am boa em spered , ne drojen ket na zoken war ledander un ivin a-ziwar va roudenn .	lakaet am boa em spered, ne drojen ket na zoken war ledander un ivin a-ziwar va roudenn. 	# 'la.kɛd ɑ̃m 'bo.a ɛm 'spe.rɛt # ne 'droʃ.ɛn ket na 'zo.ken war le.'dɑ̃n.dɛr œn 'i.vin a.'zi.war va 'ru.dɛn #	1	1	0	session_2/text/documents/A1-05_Antho_breton_3_texts_-_03_GWELL_BEZAN_MAB_KRIZ_EGET_BELEG_FALL.txt
A212_13-003-19	« N'eus ket ennon danvez beleg , emezon , ha dre se , n'in ket da Sant-Brieg » .	« N’eus ket ennon danvez beleg, emezon, ha dre se n’in ket da Sant-Brieg ». 	# nøs ked 'ɛ.nõn 'dɑ̃n.vɛs 'bɛ.lɛk # e.'me.zõn # a dre se # nin ket dɑ sɑ̃n.'bri.ɛk #	1	1	0	session_2/text/documents/A1-05_Antho_breton_3_texts_-_03_GWELL_BEZAN_MAB_KRIZ_EGET_BELEG_FALL.txt
A212_13-003-20	Dirollañ a reas da c'hoarzhin ,	Dirollañ a reas da c’hoarzhin, 	# di.'rɔ.lɑ̃ a 're.as dɑ 'xwar.zin #	1	1	0	session_2/text/documents/A1-05_Antho_breton_3_texts_-_03_GWELL_BEZAN_MAB_KRIZ_EGET_BELEG_FALL.txt
A212_13-003-21	daoust ma ne oa ket stad ennañ :	daoust ma ne oa ket stad ennañ : 	# dɔwst ma ne wa ket stɑ:d 'ɛ.nɑ̃ #	1	1	0	session_2/text/documents/A1-05_Antho_breton_3_texts_-_03_GWELL_BEZAN_MAB_KRIZ_EGET_BELEG_FALL.txt
A212_13-003-22	« Gout 'ouien , emezañ ,	« Gout ‘ouien, emezañ, 	# 'wi.ɛn # e.'me.zɑ̃ #	1	1	0	session_2/text/documents/A1-05_Antho_breton_3_texts_-_03_GWELL_BEZAN_MAB_KRIZ_EGET_BELEG_FALL.txt
A212_13-003-23	ha lavaret am boa d'an hini-gozh n'ajes ket … Met soñj ervat evelkent ,	ha lavaret am boa d’an hini-gozh n’ajes ket... Met soñj ervat evelkent, 	# a la.'vɑ.rɛd ɑ̃m 'bo.a dɑ̃n hi.'nig.os 'nɑʃ.ɛs ket # mɛt sõ:ʃ 'er.vɑd e.'vɛl.kɛnt #	1	1	0	session_2/text/documents/A1-05_Antho_breton_3_texts_-_03_GWELL_BEZAN_MAB_KRIZ_EGET_BELEG_FALL.txt
A212_13-003-24	abalamour dezhi ,	abalamour dezhi, 	# a.ba.'lɑ̃.mur 'de.zi #	1	1	0	session_2/text/documents/A1-05_Antho_breton_3_texts_-_03_GWELL_BEZAN_MAB_KRIZ_EGET_BELEG_FALL.txt
A212_13-003-25	ken brav hag he deus graet dit a-viskoazh ;	ken brav hag he deus graet dit a-viskoazh ; 	# ken braw ag e døs grɛ:t di:d a.'vi.skwas #	1	1	0	session_2/text/documents/A1-05_Antho_breton_3_texts_-_03_GWELL_BEZAN_MAB_KRIZ_EGET_BELEG_FALL.txt
A212_13-003-26	bremañ pa'z eo klañv ,	bremañ pa’z eo klañv, 	# 'bre.mɑ̃ paz ɛw klɑ̃w #	1	1	0	session_2/text/documents/A1-05_Antho_breton_3_texts_-_03_GWELL_BEZAN_MAB_KRIZ_EGET_BELEG_FALL.txt
A212_13-003-27	he gloazañ ,	he gloazañ, 	# e 'glwɑ.zɑ̃ #	1	1	0	session_2/text/documents/A1-05_Antho_breton_3_texts_-_03_GWELL_BEZAN_MAB_KRIZ_EGET_BELEG_FALL.txt
A212_13-003-28	ha zoken he lazhañ a ri mar kenderc'hez d'ober da benn-fall » .	ha zoken he lazhañ a ri mar kenderc’hez d’ober da benn-fall ». 	# a 'zo.ken e 'lɑ.zɑ̃ a ri: mɑ:r kɛn.'dɛrx.ɛs 'do.bɛr dɑ 'bɛn.fal #	1	1	0	session_2/text/documents/A1-05_Antho_breton_3_texts_-_03_GWELL_BEZAN_MAB_KRIZ_EGET_BELEG_FALL.txt
A212_13-003-29	Koll poan hag amzer a rae , 	Koll poan hag amzer a rae, 	# kɔl pwɑ̃:n ag 'ɑ̃m.zɛr a rɛ: #	1	1	0	session_2/text/documents/A1-05_Antho_breton_3_texts_-_03_GWELL_BEZAN_MAB_KRIZ_EGET_BELEG_FALL.txt
A212_13-003-30	ha kerkoulz e vije bet dezhañ reiñ lunedoù d'ur glesker , hag e bediñ da lenn a vouezh uhel er gelaouenn .	ha kerkoulz e vije bet dezhañ reiñ lunedoù d’ur glesker, hag e bediñ da lenn a vouezh uhel er gelaouenn. 	# a 'kɛr.kulz e 'vi.ʒe bet 'de.zɑ̃ rɛj ly.'ne.du dyr 'gle.skɛr # ag e 'be.di dɑ lɛn a vwe:z 'y.ɛl er ge.'lɔ.wɛn #	1	1	0	session_2/text/documents/A1-05_Antho_breton_3_texts_-_03_GWELL_BEZAN_MAB_KRIZ_EGET_BELEG_FALL.txt
A212_13-003-31	Stagañ a reas da gomz eus va mamm ,	Stagañ a reas da gomz eus va mamm, 	# 'stɑg.ɑ̃ a 're.as dɑ gõmz øs va mɑ̃m #	1	1	0	session_2/text/documents/A1-05_Antho_breton_3_texts_-_03_GWELL_BEZAN_MAB_KRIZ_EGET_BELEG_FALL.txt
A212_13-003-32	eus he gerioù diwezhañ , p'edo war he zremenvan ;	eus he gerioù diwezhañ p’edo war he zremenvan ; 	# øs e 'ger.ju di.'we.zɑ̃ # 'pe.do war e zre.'mɛn.vɑ̃n #	1	1	0	session_2/text/documents/A1-05_Antho_breton_3_texts_-_03_GWELL_BEZAN_MAB_KRIZ_EGET_BELEG_FALL.txt
A212_13-003-33	diouzh e glevout ,	diouzh e glevout, 	# djuz e 'gle.vut #	1	1	0	session_2/text/documents/A1-05_Antho_breton_3_texts_-_03_GWELL_BEZAN_MAB_KRIZ_EGET_BELEG_FALL.txt
A212_13-003-34	keuz he devoa da vont kuit dreist-holl , abalamour ne welje ket he mab o kanañ e oferenn gentañ .	keuz he devoa da vont kuit dreist-holl, abalamour ne welje ket he mab o kanañ e oferenn gentañ. 	# kø:s e 'de.vwa dɑ võn kɥit 'drɛj.stɔl # a.ba.'lɑ̃.mur ne 'wɛlʃ.e ket e mɑ:p o 'kɑ̃.nɑ̃ e o.'fe.rɛn 'gɛn.tɑ̃ #	1	1	0	session_2/text/documents/A1-05_Antho_breton_3_texts_-_03_GWELL_BEZAN_MAB_KRIZ_EGET_BELEG_FALL.txt
A212_13-003-35	Marteze a-walc'h !	Marteze a-walc’h ! 	# mar.'te.ze 'a.walx #	1	1	0	session_2/text/documents/A1-05_Antho_breton_3_texts_-_03_GWELL_BEZAN_MAB_KRIZ_EGET_BELEG_FALL.txt
A212_13-003-36	marteze ne oa ket o kontañ gevier ,	marteze ne oa ket o kontañ gevier, 	# mar.'te.ze ne wa ked o 'kõn.tɑ̃ 'ge.vjɛr #	1	1	0	session_2/text/documents/A1-05_Antho_breton_3_texts_-_03_GWELL_BEZAN_MAB_KRIZ_EGET_BELEG_FALL.txt
A212_13-003-37	met n'eus forzh ,	met n’eus forzh, 	# mɛt nøs fɔrs #	1	1	0	session_2/text/documents/A1-05_Antho_breton_3_texts_-_03_GWELL_BEZAN_MAB_KRIZ_EGET_BELEG_FALL.txt
A212_13-003-38	ne oan ket troet da hadañ kerse war-zigarez ober plijadur d'am c'herent ,	ne oan ket troet da hadañ kerse war-zigarez ober plijadur d’am c’herent, 	# ne wɑ̃:n ket 'tro.ɛt dɑ 'hɑ.dɑ̃ 'kɛr.se war.zig.'ɑ.rɛz 'o.bɛr pli.'ʒɑ.dyr dɑ̃m 'xe.rɛnt #	1	1	0	session_2/text/documents/A1-05_Antho_breton_3_texts_-_03_GWELL_BEZAN_MAB_KRIZ_EGET_BELEG_FALL.txt
A212_13-003-39	bev , pe varv .	bev pe varv. 	# bew # pe 'wɑ.ro #	1	1	0	session_2/text/documents/A1-05_Antho_breton_3_texts_-_03_GWELL_BEZAN_MAB_KRIZ_EGET_BELEG_FALL.txt
A212_13-003-40	Ne ouie ket e c'hwitje ganin kaer en divije c'hoari ,	Ne ouie ket e c’hwitje ganin kaer en divije c’hoari, 	# ne 'wi.e ked e 'xwitʃ.e 'gɑ̃.nin kɛ:r en di.'viʃ.e 'xwɑ.ri #	1	1	0	session_2/text/documents/A1-05_Antho_breton_3_texts_-_03_GWELL_BEZAN_MAB_KRIZ_EGET_BELEG_FALL.txt
A212_13-003-41	ha dre se , klask a rae bepred ,	ha dre se klask a rae bepred, 	# a dre se # klask a rɛ: 'be.pret #	1	1	0	session_2/text/documents/A1-05_Antho_breton_3_texts_-_03_GWELL_BEZAN_MAB_KRIZ_EGET_BELEG_FALL.txt
A212_13-003-42	gwech e galleg ,	gwech e galleg, 	# gweʃ e 'ga.lɛk #	1	1	0	session_2/text/documents/A1-05_Antho_breton_3_texts_-_03_GWELL_BEZAN_MAB_KRIZ_EGET_BELEG_FALL.txt
A212_13-003-43	gwech e brezhoneg ,	gwech e brezhoneg, 	# gweʃ e bre.'zõ.nɛk #	1	1	0	session_2/text/documents/A1-05_Antho_breton_3_texts_-_03_GWELL_BEZAN_MAB_KRIZ_EGET_BELEG_FALL.txt
A212_13-003-44	ar gwellañ tu d'ober din plegañ ,	ar gwellañ tu d’ober din plegañ, 	# ar 'gwɛ.lɑ̃ ty 'do.bɛr din 'pleg.ɑ̃ #	1	1	0	session_2/text/documents/A1-05_Antho_breton_3_texts_-_03_GWELL_BEZAN_MAB_KRIZ_EGET_BELEG_FALL.txt
A212_13-003-45	ha biken n'am bije kredet am boa un tad ken distagellet mat en div yezh .	ha biken n’am bije kredet am boa un tad ken distagellet mat en div yezh. 	# a 'bi.kɛn nɑ̃m 'bi.ʒe 'kre.dɛd ɑ̃m 'bo.a œn tɑ:t ken di.stag.'ɛ.lɛt mɑ:d en diw je:s #	1	1	0	session_2/text/documents/A1-05_Antho_breton_3_texts_-_03_GWELL_BEZAN_MAB_KRIZ_EGET_BELEG_FALL.txt
A212_13-003-46	Met aner 'oa dezhañ poanial , rak biskoazh ki ne zerc'has ken start d'e askorn .	Met aner ‘oa dezhañ poanial, rak biskoazh ki ne zerc’has ken start d’e askorn. 	# mɛd wa 'de.zɑ̃ pwɑ̃.'ni.al # rag 'bi.skwas ki: ne 'sɛrx.as ken start de 'a.skɔrn #	1	1	0	session_2/text/documents/A1-05_Antho_breton_3_texts_-_03_GWELL_BEZAN_MAB_KRIZ_EGET_BELEG_FALL.txt
A212_13-003-47	A-benn ar fin ,	A-benn ar fin, 	# 'a.bɛn ar fi:n #	1	1	0	session_2/text/documents/A1-05_Antho_breton_3_texts_-_03_GWELL_BEZAN_MAB_KRIZ_EGET_BELEG_FALL.txt
A212_13-003-48	en em lakeas da ouelañ ha war an taol e chomis gant va genou digor bras ,	en em lakeas da ouelañ ha war an taol e chomis gant va genou digor bras, 	# en ɛm la.'ke.az dɑ 'we.lɑ̃ a war ɑ̃n tɔ:l e 'ʃõ.miz gɑ̃n va 'ge.nu 'dig.ɔr brɑ:s #	1	1	0	session_2/text/documents/A1-05_Antho_breton_3_texts_-_03_GWELL_BEZAN_MAB_KRIZ_EGET_BELEG_FALL.txt
A212_13-003-49	rak kammed ne oa degouezhet dezhañ , ober kemend-all dirazon .	rak kammed ne oa degouezhet dezhañ, ober kemend-all dirazon. 	# rak 'kɑ̃.mɛt ne wa de.'gwe.zɛt 'de.zɑ̃ # 'o.bɛr ke.'mɛn.dal di.'rɑ.zõn #	1	1	0	session_2/text/documents/A1-05_Antho_breton_3_texts_-_03_GWELL_BEZAN_MAB_KRIZ_EGET_BELEG_FALL.txt
A212_13-003-50	Truez am boa outañ evel just ha war an dro fent a rae din un tammig ,	Truez am boa outañ evel just ha war an dro fent a rae din un tammig, 	# 'try.ɛz ɑ̃m 'bo.a 'u.tɑ̃ 'e.vɛl ʒyst a war ɑ̃n dro fɛnd a rɛ: din œn 'tɑ̃.mik #	1	1	0	session_2/text/documents/A1-05_Antho_breton_3_texts_-_03_GWELL_BEZAN_MAB_KRIZ_EGET_BELEG_FALL.txt
A212_13-003-51	rak o vezañ ne oa ket gwall gustum da leñvañ ,	rak o vezañ ne oa ket gwall gustum da leñvañ, 	# rag o 've.zɑ̃ ne wa ket gwal 'gy.stym dɑ 'lẽ.vɑ̃ #	1	1	0	session_2/text/documents/A1-05_Antho_breton_3_texts_-_03_GWELL_BEZAN_MAB_KRIZ_EGET_BELEG_FALL.txt
A212_13-003-52	ober a rae evel pa vije bet o sachañ Loull d'e doull . 	ober a rae evel pa vije bet o sachañ Loull d’e doull. 	# 'o.bɛr a rɛ: 'e.vɛl pa 'vi.ʒe bed o 'saʃ.ɑ̃ lul de dul #	1	1	0	session_2/text/documents/A1-05_Antho_breton_3_texts_-_03_GWELL_BEZAN_MAB_KRIZ_EGET_BELEG_FALL.txt
A212_13-003-53	E porzh bihan ar skolaj e oamp , e-kichen ar chapel ;	E porzh bihan ar skolaj e oamp, e-kichen ar chapel ; 	# e pɔrs 'bi.ɑ̃n ar 'sko.laʒ e wɑ̃m # e.'kiʃ.ɛn ar 'ʃa.pɛl #	1	1	0	session_2/text/documents/A1-05_Antho_breton_3_texts_-_03_GWELL_BEZAN_MAB_KRIZ_EGET_BELEG_FALL.txt
A212_13-003-54	krog 'oa dija an ofis ,	krog ‘oa dija an ofis, 	# kro:k wa 'di.ʒɑ ɑ̃n 'o.fis #	1	1	0	session_2/text/documents/A1-05_Antho_breton_3_texts_-_03_GWELL_BEZAN_MAB_KRIZ_EGET_BELEG_FALL.txt
A212_13-003-55	ha klevout a raen va c'henskolidi o kanañ : O Salutaris ;	ha klevout a raen va c’henskolidi o kanañ :O Salutaris ; 	# a 'kle.vud a rẽn va xɛn.sko.'li.di o 'kɑ̃.nɑ̃ # o sa.ly.'tɑ.ris #	1	1	0	session_2/text/documents/A1-05_Antho_breton_3_texts_-_03_GWELL_BEZAN_MAB_KRIZ_EGET_BELEG_FALL.txt
A212_13-003-56	eus dor ar sekretiri e teue d'am bete c'hwezh an ezañs ,	eus dor ar sekretiri e teue d’am bete c’hwezh an ezañs, 	# øs do:r ar se.kre.'ti.ri e 'tø.e dɑ̃m 'be.te xwez ɑ̃n 'e.zɑ̃s #	1	1	0	session_2/text/documents/A1-05_Antho_breton_3_texts_-_03_GWELL_BEZAN_MAB_KRIZ_EGET_BELEG_FALL.txt
A212_13-003-57	ha santout a ran c'hoazh war va muzelloù , blaz c'hwerv an delienn lore , na baouezen ket da grignat en ur sellout ouzh ar paour kaezh den , a droe kein din ,	ha santout a ran c’hoazh war va muzelloù, blaz c’hwerv an delienn lore, na baouezen ket da grignat en ur sellout ouzh ar paour kaezh den a droe kein din, 	# a 'sɑ̃n.tud a rɑ̃:n xwas war va my.'zɛ.lu # blɑ:s 'xwɛ.ro ɑ̃n 'de.ljɛn 'lo.re # na bɔ.'we.sɛn ket dɑ 'griɲ.ad en œr 'sɛ.lud uz ar pɔwr kɛ:s de:n # a 'dro.e kɛjn din #	1	1	0	session_2/text/documents/A1-05_Antho_breton_3_texts_-_03_GWELL_BEZAN_MAB_KRIZ_EGET_BELEG_FALL.txt
A212_13-003-58	pa felle dezhañ torchañ e zaoulagad gant e gildorn .	pa felle dezhañ torchañ e zaoulagad gant e gildorn. 	# pa 'fɛ.le 'de.zɑ̃ 'tɔrʃ.ɑ̃ e zɔw.'lɑg.at gɑ̃n e 'gil.dɔrn #	1	1	0	session_2/text/documents/A1-05_Antho_breton_3_texts_-_03_GWELL_BEZAN_MAB_KRIZ_EGET_BELEG_FALL.txt
A212_13-003-59	« Ma ! a soñjen neuze , gwelloc'h eo ganin bezañ ur mab kriz eget ur beleg fall-daonet » .	« Ma ! a soñjen neuze, gwelloc’h eo ganin bezañ ur mab kriz eget ur beleg fall-daonet ». 	# ma # a 'sõʃ.ɛn 'nø.ze # 'gwɛ.lɔh ɛw 'gɑ̃.nin 'be.zɑ̃ œr mɑ:p kri:z 'eg.ed œr 'bɛ.lɛk fal.'dɑ̃w.nɛt #	1	1	0	session_2/text/documents/A1-05_Antho_breton_3_texts_-_03_GWELL_BEZAN_MAB_KRIZ_EGET_BELEG_FALL.txt
A212_13-003-60	Met pa'z eas kuit d'an diwezh ,	Met pa’z eas kuit d’an diwezh, 	# mɛt paz 'e.as kɥit dɑ̃n 'di.wes #	1	1	0	session_2/text/documents/A1-05_Antho_breton_3_texts_-_03_GWELL_BEZAN_MAB_KRIZ_EGET_BELEG_FALL.txt
A212_13-003-61	stouet e benn gantañ , ha kalz krommoc'h e chouk ,	stouet e benn gantañ ha kalz krommoc’h e chouk, 	# 'stu.ɛd e bɛn 'gɑ̃n.tɑ̃ # a kals 'krõ.mɔh e ʃuk #	1	1	0	session_2/text/documents/A1-05_Antho_breton_3_texts_-_03_GWELL_BEZAN_MAB_KRIZ_EGET_BELEG_FALL.txt
A212_13-003-62	hag-eñ , o horellañ un nebeudig dre ma krene moarvat e zivhar dindanañ ,	hag-eñ o horellañ un nebeudig dre ma krene moarvat e zivhar dindanañ, 	# 'ag.ẽ # o ho.'rɛ.lɑ̃ œn ne.'bø.dig dre ma 'kre.ne 'mwar.vɑd e 'ziwh.ar din.'dɑ̃.nɑ̃ #	1	1	0	session_2/text/documents/A1-05_Antho_breton_3_texts_-_03_GWELL_BEZAN_MAB_KRIZ_EGET_BELEG_FALL.txt
A212_13-003-63	rak ne oa ket mezv ar sul-se ,	rak ne oa ket mezv ar sul-se, 	# rag ne wa ket mɛw ar 'syl.se #	1	1	0	session_2/text/documents/A1-05_Antho_breton_3_texts_-_03_GWELL_BEZAN_MAB_KRIZ_EGET_BELEG_FALL.txt
A212_13-003-64	darbet e voe din mont war wakaat ,	darbet e voe din mont war wakaat, 	# 'dar.bɛd e vwe: din mõn war 'wa.kɑt #	1	1	0	session_2/text/documents/A1-05_Antho_breton_3_texts_-_03_GWELL_BEZAN_MAB_KRIZ_EGET_BELEG_FALL.txt
A212_13-003-65	ha n'ouzon ket kaer penaos , e viris ouzhin da redek war e lerc'h en ur grial :	ha n’ouzon ket kaer penaos e viris ouzhin da redek war e lerc’h en ur grial : 	# a 'nu.sõn ket kɛ:r 'pe.nos # e 'vi.riz 'u.zin dɑ 're.dɛg war e lɛrh en œr 'gri.al #	1	1	0	session_2/text/documents/A1-05_Antho_breton_3_texts_-_03_GWELL_BEZAN_MAB_KRIZ_EGET_BELEG_FALL.txt
A212_13-003-66	« Ac'hañ 'ta geo ,	« Ac’hañ ‘ta geo, 	# tɑ gɛw #	1	1	0	session_2/text/documents/A1-05_Antho_breton_3_texts_-_03_GWELL_BEZAN_MAB_KRIZ_EGET_BELEG_FALL.txt
A212_13-003-67	mont a rin da Sant-Brieg ,	mont a rin da Sant-Brieg, 	# mõnd a ri:n dɑ sɑ̃n.'bri.ɛk #	1	1	0	session_2/text/documents/A1-05_Antho_breton_3_texts_-_03_GWELL_BEZAN_MAB_KRIZ_EGET_BELEG_FALL.txt
A212_13-003-68	met en anv Doue , paouezit da ouelañ ! »	met en anv Doue, paouezit da ouelañ ! »	# mɛd en 'ɑ̃.no 'du.e # pɔ.'we.zit dɑ 'we.lɑ̃ #	1	1	0	session_2/text/documents/A1-05_Antho_breton_3_texts_-_03_GWELL_BEZAN_MAB_KRIZ_EGET_BELEG_FALL.txt
A212_13-004	mil nav c'hant pevar hag hanter-kant	1954	# mil naw xɑ̃n 'pe.var ag hɑ̃n.'tɛr.kɑ̃nt #	1	1	0	session_2/text/documents/A1-05_Antho_breton_3_texts_-_03_GWELL_BEZAN_MAB_KRIZ_EGET_BELEG_FALL.txt
A212_13-100	Ronan Huon	Ronan Huon	# 'ro.nɑ̃n 'y.õn #	1	1	0	session_2/text/documents/A2-25_Antho_breton_3_texts_-_13_EN_DRAONIENN.txt
A212_13-101	En draonienn	En draonienn	# en 'drɑ̃w.njɛn #	1	1	0	session_2/text/documents/A2-25_Antho_breton_3_texts_-_13_EN_DRAONIENN.txt
A212_13-102	pajenn seizh	p. 7	# 'pɑ.ʒɛn sɛjs #	1	1	0	session_2/text/documents/A2-25_Antho_breton_3_texts_-_13_EN_DRAONIENN.txt
A212_13-103-00	Kalon Herve a reas ul lamm .	Kalon Herve a reas ul lamm. 	# 'kɑ.lõn 'hɛr.ve a 're.az œl lɑ̃m #	1	1	0	session_2/text/documents/A2-25_Antho_breton_3_texts_-_13_EN_DRAONIENN.txt
A212_13-103-01	Edo en e gichen .	Edo en e gichen. 	# 'e.do en e 'giʃ.ɛn #	1	1	0	session_2/text/documents/A2-25_Antho_breton_3_texts_-_13_EN_DRAONIENN.txt
A212_13-103-02	Hopal a reas warni : « Karol ! » .	Hopal a reas warni : « Karol ! ».	# 'ho.pal a 're.as 'war.ni # 'kɑ.rol #	1	1	0	session_2/text/documents/A2-25_Antho_breton_3_texts_-_13_EN_DRAONIENN.txt
A212_13-104-00	He blev gell a nije un tammig en avel , hag e savas he dorn evit o derc'hel ,	He blev gell a nije un tammig en avel hag e savas he dorn evit o derc’hel, 	# e blɛw gɛl a 'niʃ.e œn 'tɑ̃.mig en 'ɑ.vɛl # ag e 'sa.vaz e dɔrn 'e.vid o 'dɛrh.ɛl #	1	1	0	session_2/text/documents/A2-25_Antho_breton_3_texts_-_13_EN_DRAONIENN.txt
A212_13-104-01	met ne droas ket ouzh e du ,	met ne droas ket ouzh e du, 	# mɛt ne drwas ked uz e dy #	1	1	0	session_2/text/documents/A2-25_Antho_breton_3_texts_-_13_EN_DRAONIENN.txt
A212_13-104-02	ha todion an tren a c'holoe mouezh ar paotr .	ha todion an tren a c’holoe mouezh ar paotr.	# a to.'di.õn ɑ̃n trɛn a xo.'lo.e mwe:z ar pɔtr #	1	1	0	session_2/text/documents/A2-25_Antho_breton_3_texts_-_13_EN_DRAONIENN.txt
A212_13-105-00	Kregiñ a reas Herve da redek , par ma c'helle , er wenodenn a-hed al linenn .	Kregiñ a reas Herve da redek, par ma c’helle, er wenodenn a-hed al linenn. 	# 'kreg.i a 're.as 'hɛr.ve dɑ 're.dɛk # pɑ:r ma 'xɛ.le # er we.'no.dɛn 'ah.ed al 'li.nɛn #	1	1	0	session_2/text/documents/A2-25_Antho_breton_3_texts_-_13_EN_DRAONIENN.txt
A212_13-105-01	Gervel a reas adarre , en ur hejañ e zivrec'h .	Gervel a reas adarre, en ur hejañ e zivrec’h. 	# 'gɛr.vɛl a 're.az a.'da.re # en œr 'he.ʒɑ̃ e 'zi.vrex #	1	1	0	session_2/text/documents/A2-25_Antho_breton_3_texts_-_13_EN_DRAONIENN.txt
A212_13-105-02	Ar beajour a reas eveltañ , hag e c'henou a zigoras bras , met , 	Ar beajour a reas eveltañ, hag e c’henou a zigoras bras, met, 	# ar be.'ɑ.ʒur a 're.az e.'vɛl.tɑ̃ # ag e 'xe.nu a zig.'o.raz brɑ:s # mɛt #	1	1	0	session_2/text/documents/A2-25_Antho_breton_3_texts_-_13_EN_DRAONIENN.txt
A212_13-105-03	evel en un huñvre pe ur film mut , ne zeuas son ebet er-maez .	evel en un huñvre pe ur film mut, ne zeuas son ebet er-maez. 	# 'e.vɛl en œn 'hỹ.vre pe œr film my:t # ne 'zø.as sõ:n 'e.bed 'er.mɛs #	1	1	0	session_2/text/documents/A2-25_Antho_breton_3_texts_-_13_EN_DRAONIENN.txt
A212_13-105-04	Ur pistig a warizi a savas ennañ .	Ur pistig a warizi a savas ennañ. 	# œr 'pi.stig a wa.'ri.zi a 'sa.vaz 'ɛ.nɑ̃ #	1	1	0	session_2/text/documents/A2-25_Antho_breton_3_texts_-_13_EN_DRAONIENN.txt
A212_13-105-05	C'hoant en devoa da ouelañ .	C’hoant en devoa da ouelañ. 	# xwɑ̃nd en 'de.vwa dɑ 'we.lɑ̃ #	1	1	0	session_2/text/documents/A2-25_Antho_breton_3_texts_-_13_EN_DRAONIENN.txt
A212_13-105-06	Ur fourrad avel a hejas adarre ar blev gell fonnus en devoa flouret ur wech .	Ur fourrad avel a hejas adarre ar blev gell fonnus en devoa flouret ur wech. 	# œr 'fu.rad 'ɑ.vɛl a 'he.ʒaz a.'da.re ar blɛw gɛl 'fõ.nyz en 'de.vwa 'flu.rɛd œr weʃ #	1	1	0	session_2/text/documents/A2-25_Antho_breton_3_texts_-_13_EN_DRAONIENN.txt
A212_13-105-07	Trelatet e oa , gant ar weledigezh-se , ken dic'hortoz , en draonienn didud .	Trelatet e oa gant ar weledigezh-se, ken dic’hortoz, en draonienn didud. 	# tre.'la.tɛd e wa # gɑ̃n ar we.le.'dig.ez.se # ken dih.'ɔr.tos # en 'drɑ̃w.njɛn 'di.dyt #	1	1	0	session_2/text/documents/A2-25_Antho_breton_3_texts_-_13_EN_DRAONIENN.txt
A212_13-105-08	Karol !	Karol !	# 'kɑ.rol #	1	1	0	session_2/text/documents/A2-25_Antho_breton_3_texts_-_13_EN_DRAONIENN.txt
A212_13-106-00	Aet e oa an tren diwar-wel .	Aet e oa an tren diwar-wel. 	# ɛ:d e wa ɑ̃n trɛn di.'war.wel #	1	1	0	session_2/text/documents/A2-25_Antho_breton_3_texts_-_13_EN_DRAONIENN.txt
A212_13-106-01	Krenañ a reas ar paotr gant ar yenijenn .	Krenañ a reas ar paotr gant ar yenijenn. 	# 'kre.nɑ̃ a 're.az ar pɔt gɑ̃n ar je.'ni.ʒɛn #	1	1	0	session_2/text/documents/A2-25_Antho_breton_3_texts_-_13_EN_DRAONIENN.txt
A212_13-106-02	Neuze e teuas da soñj dezhañ he devoa Karol ur voereb en Uhelgoad , 	Neuze e teuas da soñj dezhañ he devoa Karol ur voereb en Uhelgoad, 	# 'nø.ze e 'tø.az dɑ sõ:ʃ 'de.zɑ̃ e 'de.vwa 'kɑ.rol œr vo.'e.rɛp en y.'ɛl.gwat #	1	1	0	session_2/text/documents/A2-25_Antho_breton_3_texts_-_13_EN_DRAONIENN.txt
A212_13-106-03	hag he devoa lavaret dezhañ ez ae di a-wechoù e-pad ar vakañsoù bras ,	hag he devoa lavaret dezhañ ez ae di a-wechoù e-pad ar vakañsoù bras, 	# ag e 'de.vwa la.'vɑ.rɛt 'de.zɑ̃ ez ɛ di a.'weʃ.u 'e.pɑd ar va.'kɑ̃.su brɑ:s #	1	1	0	session_2/text/documents/A2-25_Antho_breton_3_texts_-_13_EN_DRAONIENN.txt
A212_13-106-04	hag evel just ,	hag evel just, 	# ag 'e.vɛl ʒyst #	1	1	0	session_2/text/documents/A2-25_Antho_breton_3_texts_-_13_EN_DRAONIENN.txt
A212_13-106-05	edo an tren bihan o vont war e bouezig betek eno .	edo an tren bihan o vont war e bouezig betek eno.	# 'e.do ɑ̃n trɛn 'bi.ɑ̃n o võn war e 'bwe.zig 'be.teg 'e.no #	1	1	0	session_2/text/documents/A2-25_Antho_breton_3_texts_-_13_EN_DRAONIENN.txt
