A212_13-000	Jarl Priel	Jarl Priel	# ʒarl 'pri.jɛl #	1	1	0	session_2/text/documents/A1-05_Antho_breton_3_texts_-_03_GWELL_BEZAN_MAB_KRIZ_EGET_BELEG_FALL.txt
A212_13-304-01	 troet e voe un alc'houez , hag e strinkas muzik adarre .	troet e voe un alc’houez, hag e strinkas muzik adarre. 	# 'tro.ɛd e vwe: œn 'alx.wɛs # ag e 'striŋ.kaz 'my.zig a.'da.re #	1	1	0	session_2/text/documents/A4-72_Antho_breton_3_texts_-_54_O_C_HARZHATA.txt
A212_13-304-02	Ar c'houbladoù tud yaouank en em glaskas , hag a adstagas da dreiñ evel kornigelloù .	Ar c’houbladoù tud yaouank en em glaskas, hag a adstagas da dreiñ evel kornigelloù.	# ar xu.'blɑ.du ty:d 'jɔ.wɑ̃ŋg en ɛm 'glɑ.skas # ag a at.'stɑg.az dɑ drɛj 'e.vɛl kɔr.nig.'ɛ.lu #	1	1	0	session_2/text/documents/A4-72_Antho_breton_3_texts_-_54_O_C_HARZHATA.txt
A212_13-305	N'en em gave ket mui ar baotred vihan en o bleud , ha kent d'an dañs echuiñ , e oant en em silet kuit .	N’en em gave ket mui ar baotred vihan en o bleud, ha kent d’an dañs echuiñ e oant en em silet kuit.	# nen ɛm 'ga.ve ket mɥi: ar 'bɔ.trɛd 'vih.ɑ̃n en o bløt # a kɛn dɑ̃n dɑ̃z eʃ.'y.i # e wɑ̃nd en ɛm 'si.lɛt kɥit #	1	1	0	session_2/text/documents/A4-72_Antho_breton_3_texts_-_54_O_C_HARZHATA.txt
A212_13-306-00	Hastañ a raent buan , e riskl da deukañ ouzh ar vein ,	Hastañ a raent buan, e riskl da deukañ ouzh ar vein, 	# 'ha.stɑ̃ a rẽn 'by.ɑ̃n # e riskl dɑ 'dø.kɑ̃ uz ar vɛjn #	1	1	0	session_2/text/documents/A4-72_Antho_breton_3_texts_-_54_O_C_HARZHATA.txt
A212_13-306-01	daoust d'ar gouloù a skoe pil Amede …	daoust d’ar gouloù a skoe pil Amede... 	# dɔwst dar 'gu.lu a 'sko.e pi:l ɑ̃.'me.de #	1	1	0	session_2/text/documents/A4-72_Antho_breton_3_texts_-_54_O_C_HARZHATA.txt
A212_13-306-02	Den ebet , avat , ne c'houlennas diganto ,	Den ebet, avat, ne c’houlennas diganto, 	# de:n 'e.bet # 'a.vat # ne xu.'lɛ.naz dig.'ɑ̃n.to #	1	1	0	session_2/text/documents/A4-72_Antho_breton_3_texts_-_54_O_C_HARZHATA.txt
A212_13-306-03	p'en em gavjont er gêr , e pelec'h e oant bet ,	p’en em gavjont er gêr, e pelec’h e oant bet, 	# pen ɛm 'gav.ʒõnd er gɛr # e 'pe.lɛh e wɑ̃n bet #	1	1	0	session_2/text/documents/A4-72_Antho_breton_3_texts_-_54_O_C_HARZHATA.txt
A212_13-306-04	rak gant an Aotrou Kure e oant kustum da dremen ar sul d'abardaez .	rak gant an Aotrou Kure e oant kustum da dremen ar sul d’abardaez.	# rag gɑ̃n ɑ̃n 'ɔ.tru 'ky.re e wɑ̃n 'ky.stym dɑ 'dre.mɛn ar sy:l da.bar.'da.ɛs #	1	1	0	session_2/text/documents/A4-72_Antho_breton_3_texts_-_54_O_C_HARZHATA.txt
A212_13-307-00	Antronoz vintin , p'edo Arsen o tihuniñ , 	Antronoz vintin, p’edo Arsen o tihuniñ, 	# ɑ̃n.'trõ.nos 'vin.tin # 'pe.do 'ar.sɛn o tih.'y.ni #	1	1	0	session_2/text/documents/A4-72_Antho_breton_3_texts_-_54_O_C_HARZHATA.txt
A212_13-307-01	e stagas da ganañ hep gouzout dezhañ , an ton desket digant ar sonskriverez :	e stagas da ganañ hep gouzout dezhañ, an ton desket digant ar sonskriverez :	# e 'stɑg.az dɑ 'gɑ̃.nɑ̃ hep 'gu.zut 'de.zɑ̃ # ɑ̃n tõ:n 'de.skɛt 'dig.ɑ̃nd ar sõn.skri.'ve.rɛs #	1	1	0	session_2/text/documents/A4-72_Antho_breton_3_texts_-_54_O_C_HARZHATA.txt
A212_13-308	J'ai commencé par engueuler l'Patron …	J’ai commencé par engueuler l’Patron...	# ʒaj kõ.'mɛn.ke pɑ:r eng.y.'ø.lɛr 'lpa.trõn #	1	1	0	session_2/text/documents/A4-72_Antho_breton_3_texts_-_54_O_C_HARZHATA.txt
A212_13-309-00	E vamm a sellas outañ : « Petra 'out-te o kanañ , emezi ? »	E vamm a sellas outañ : « Petra ‘out-te o kanañ, emezi ? » 	# e vɑ̃m a 'sɛ.laz 'u.tɑ̃ # 'ut.te o 'kɑ̃.nɑ̃ # e.'me.zi #	1	1	0	session_2/text/documents/A4-72_Antho_breton_3_texts_-_54_O_C_HARZHATA.txt
A212_13-309-01	Ruziañ a reas Arsen un tammig , ha tevel .	Ruziañ a reas Arsen un tammig, ha tevel. 	# 'ry.zjɑ̃ a 're.az 'ar.sɛn œn 'tɑ̃.mik # a 'te.vɛl #	1	1	0	session_2/text/documents/A4-72_Antho_breton_3_texts_-_54_O_C_HARZHATA.txt
A212_13-309-02	N'eo ket abalamour ma kave dizoare ar ganaouenn ; gant aon d'en em werzhañ na lavaran ket .	N’eo ket abalamour ma kave dizoare ar ganaouenn ; gant aon d’en em werzhañ na lavaran ket. 	# new ked a.ba.'lɑ̃.mur ma 'ka.ve diz.'wɑ.re ar gɑ̃.'nɔ.wɛn # gɑ̃n ɑ̃wn den ɛm 'wɛr.zɑ̃ na la.'vɑ.rɑ̃n ket #	1	1	0	session_2/text/documents/A4-72_Antho_breton_3_texts_-_54_O_C_HARZHATA.txt
A212_13-309-03	Gant aon da anzav pelec'h e oa bet an deiz a-raok !	Gant aon da anzav pelec’h e oa bet an deiz a-raok !... 	# gɑ̃n ɑ̃wn dɑ 'ɑ̃n.zaw 'pe.lɛh e wa bed ɑ̃n dɛjz 'a.rɔk #	1	1	0	session_2/text/documents/A4-72_Antho_breton_3_texts_-_54_O_C_HARZHATA.txt
A212_13-309-04	… Derc'hel a reas e vamm gant he labour …	Derc’hel a reas e vamm gant he labour...	# 'dɛrh.ɛl a 're.az e vɑ̃m gɑ̃n e 'lɑ.bur #	1	1	0	session_2/text/documents/A4-72_Antho_breton_3_texts_-_54_O_C_HARZHATA.txt
A212_13-310	Plijadur o doe ar vugale ouzh en em gaout asamblez , hag o komz diwar-benn o zroiad .	Plijadur o doe ar vugale ouzh en em gaout asamblez hag o komz diwar-benn o zroiad.	# pli.'ʒɑ.dyr o 'do.e ar vyg.'ɑ.le uz en ɛm gɔwd a.'sɑ̃m.blɛs # ag o kõms di.'war.bɛn o 'zro.jat #	1	1	0	session_2/text/documents/A4-72_Antho_breton_3_texts_-_54_O_C_HARZHATA.txt
A212_13-311-00	Ar meurzh beure avat , p'edo Arsen o vont d'ar skol , 	Ar meurzh beure avat, p’edo Arsen o vont d’ar skol, 	# ar mœrs 'bø.re 'a.vat # 'pe.do 'ar.sɛn o võn dar sko:l #	1	1	0	session_2/text/documents/A4-72_Antho_breton_3_texts_-_54_O_C_HARZHATA.txt
A212_13-311-01	e welas daou archer e ti Amede , o kaozeal gant e vamm .	e welas daou archer e ti Amede, o kaozeal gant e vamm. 	# e 'we.laz dɔw 'arʃ.ɛr e ti: ɑ̃.'me.de # o ko.'ze.al gɑ̃n e vɑ̃m #	1	1	0	session_2/text/documents/A4-72_Antho_breton_3_texts_-_54_O_C_HARZHATA.txt
A212_13-311-02	Homañ a oa trist-trist !	Homañ a oa trist-trist ! 	# 'hõ.mɑ̃ a wa 'trist.trist #	1	1	0	session_2/text/documents/A4-72_Antho_breton_3_texts_-_54_O_C_HARZHATA.txt
A212_13-311-03	Ur c'hlaouenn a skoas e kalon Arsen .	Ur c’hlaouenn a skoas e kalon Arsen. 	# œr 'xlɔ.wɛn a skwaz e 'kɑ.lõn 'ar.sɛn #	1	1	0	session_2/text/documents/A4-72_Antho_breton_3_texts_-_54_O_C_HARZHATA.txt
A212_13-311-04	Hastañ 'reas buan tremen , ha redek d'ar skol .	Hastañ ‘reas buan tremen, ha redek d’ar skol. 	# 'ha.stɑ̃ 're.az 'by.ɑ̃n 'tre.mɛn # a 're.dɛg dar sko:l #	1	1	0	session_2/text/documents/A4-72_Antho_breton_3_texts_-_54_O_C_HARZHATA.txt
A212_13-311-05	Ne oa ket erru Amede .	Ne oa ket erru Amede.	# ne wa ked 'ɛ.ry ɑ̃.'me.de #	1	1	0	session_2/text/documents/A4-72_Antho_breton_3_texts_-_54_O_C_HARZHATA.txt
A212_13-312-00	N'erruas ket an deiz-se er skol ,	N’erruas ket an deiz-se er skol, 	# nɛ.'ry.as ked ɑ̃n 'dɛjz.se er sko:l #	1	1	0	session_2/text/documents/A4-72_Antho_breton_3_texts_-_54_O_C_HARZHATA.txt
A212_13-312-01	nag an deiz war-lerc'h ,	nag an deiz war-lerc’h, 	# nag ɑ̃n dɛjs 'war.lɛrx #	1	1	0	session_2/text/documents/A4-72_Antho_breton_3_texts_-_54_O_C_HARZHATA.txt
A212_13-312-02	ha pa zispakas e fri ar gwener beure , e oa trist e benn ,	ha pa zispakas e fri ar gwener beure, e oa trist e benn, 	# a pa zi.'spa.kaz e fri: ar 'gwe.nɛr 'bø.re # e wa trisd e bɛn #	1	1	0	session_2/text/documents/A4-72_Antho_breton_3_texts_-_54_O_C_HARZHATA.txt
A212_13-312-03	evel Doue Pleuveur ,	evel Doue Pleuveur, 	# 'e.vɛl 'du.e 'plø.vœr #	1	1	0	session_2/text/documents/A4-72_Antho_breton_3_texts_-_54_O_C_HARZHATA.txt
A212_13-312-04	ha mezhek .	ha mezhek. 	# a 'me.zɛk #	1	1	0	session_2/text/documents/A4-72_Antho_breton_3_texts_-_54_O_C_HARZHATA.txt
A212_13-312-05	N'eas ket d'ar prizon , na d'ar galeoù ; 	N’eas ket d’ar prizon, na d’ar galeoù ; 	# 'ne.as ket dar 'pri.zõn # na dar ga.'le.u #	1	1	0	session_2/text/documents/A4-72_Antho_breton_3_texts_-_54_O_C_HARZHATA.txt
A212_13-312-06	akuitañ a reas gant ur pred bazhadoù , hag un tamm bara sec'h . 	akuitañ a reas gant ur pred bazhadoù, hag un tamm bara sec’h. 	# a.'kɥi.tɑ̃ a 're.as gɑ̃n œr pre:t ba.'zɑ.du # ag œn tɑ̃m 'bɑ.ra sex #	1	1	0	session_2/text/documents/A4-72_Antho_breton_3_texts_-_54_O_C_HARZHATA.txt
A212_13-312-07	E dud a zaskoras an arc'hant bet kavet gantañ war an hent .	E dud a zaskoras an arc’hant bet kavet gantañ war an hent.	# e dy:d a za.'sko.raz ɑ̃n 'arx.ɑ̃n bet 'ka.ved 'gɑ̃n.tɑ̃ war ɑ̃n hɛnt #	1	1	0	session_2/text/documents/A4-72_Antho_breton_3_texts_-_54_O_C_HARZHATA.txt
A212_13-313-00	Un alc'houez burzhudus e oa bet an arc'hant-se etre e zaouarn , evitañ , hag e gamaradoù vihan .	Un alc’houez burzhudus e oa bet an arc’hant-se etre e zaouarn, evitañ, hag e gamaradoù vihan. 	# œn 'alx.wɛs byr.'zy.dyz e wa bed ɑ̃n 'arx.ɑ̃n.se 'e.tre e 'zɔ.warn # e.'vi.tɑ̃ # ag e gɑ̃.ma.'rɑ.du 'vih.ɑ̃n #	1	1	0	session_2/text/documents/A4-72_Antho_breton_3_texts_-_54_O_C_HARZHATA.txt
A212_13-313-01	Rak ur vouezh vev kuzhet en ur pres bihan hag o kanañ dre ur c'horn digor-bras ,	Rak ur vouezh vev kuzhet en ur pres bihan hag o kanañ dre ur c’horn digor-bras, 	# rag œr vwez vew 'ky.zɛd en œr pre:s 'bi.ɑ̃n ag o 'kɑ̃.nɑ̃ dre œr xɔrn dig.'or.bras #	1	1	0	session_2/text/documents/A4-72_Antho_breton_3_texts_-_54_O_C_HARZHATA.txt
A212_13-313-02	sed na vez klevet nemet ur wech gant pep den en e vuhez .	sed na vez klevet nemet ur wech gant pep den en e vuhez.	# se:t na ve:s 'kle.vɛt 'ne.med œr weʃ gɑ̃n pep de:n en e 'vy.ɛs #	1	1	0	session_2/text/documents/A4-72_Antho_breton_3_texts_-_54_O_C_HARZHATA.txt
A212_13-314	mil nav c'hant pemp ha hanter-kant	1955	# mil naw xɑ̃n pɛm a hɑ̃n.'tɛr.kɑ̃nt #	1	1	0	session_2/text/documents/A4-72_Antho_breton_3_texts_-_54_O_C_HARZHATA.txt
A212_13-315	( Al liamm , niverenn tri hag hanter-kant , pajenn triwec'h )	(AL LIAMM n. 53, p. 18)	# al ljɑ̃m # ni.'ve.rɛn tri: ag hɑ̃n.'tɛr.kɑ̃nt # 'pɑ.ʒɛn 'tri.wɛx #	1	1	0	session_2/text/documents/A4-72_Antho_breton_3_texts_-_54_O_C_HARZHATA.txt
A212_13-400	Ernest ar Barzig	Ernest ar Barzig	# 'ɛr.nɛsd ar 'bar.zik #	1	1	0	session_2/text/documents/A5-82_Antho_breton_3_texts_-_64_MARKIZ.txt
A212_13-401	Markiz	Markiz	# 'mar.kis #	1	1	0	session_2/text/documents/A5-82_Antho_breton_3_texts_-_64_MARKIZ.txt
A212_13-402	pajenn nav ha tregont	p. 39	# 'pɑ.ʒɛn naw a 'treg.õnt #	1	1	0	session_2/text/documents/A5-82_Antho_breton_3_texts_-_64_MARKIZ.txt
A212_13-403-00	« Mardouen ya 'vat , Aogustin ,	« Mardouen ya ‘vat, Aogustin, 	# mar.'du.ɛn vɑt # ɔg.'y.stin #	1	1	0	session_2/text/documents/A5-82_Antho_breton_3_texts_-_64_MARKIZ.txt
A212_13-403-01	 hennezh 'vo lorc'h en e foñs o vont ganit ,	hennezh ‘vo lorc’h en e foñs o vont ganit, 	# 'he.nɛs vo lɔrh en e fõ:z o võn 'gɑ̃.nit #	1	1	0	session_2/text/documents/A5-82_Antho_breton_3_texts_-_64_MARKIZ.txt
A212_13-403-02	plijout a ra dezhañ gwragez yaouank ha koant , » 	plijout a ra dezhañ gwragez yaouank ha koant, » 	# 'pli.ʒud a ra 'de.zɑ̃ 'gwrɑg.ɛz 'jɔ.wɑ̃ŋg a kwɑ̃nt #	1	1	0	session_2/text/documents/A5-82_Antho_breton_3_texts_-_64_MARKIZ.txt
A212_13-403-03	eme paotr e forn o farsal .	eme paotr e forn o farsal. 	# 'e.me pɔtr e fɔrn o 'far.sal #	1	1	0	session_2/text/documents/A5-82_Antho_breton_3_texts_-_64_MARKIZ.txt
A212_13-403-04	Reiñ a reas goude un toulladig alioù d'am zintin .	Reiñ a reas goude un toulladig alioù d’am zintin. 	# rɛj a 're.as 'gu.de œn tu.'lɑ.dig ɑ.'li.u dɑ̃m 'zin.tin #	1	1	0	session_2/text/documents/A5-82_Antho_breton_3_texts_-_64_MARKIZ.txt
A212_13-403-05	Petra just a-walc'h ?	Petra just a-walc’h ? 	# 'pe.tra ʒysd 'a.walx #	1	1	0	session_2/text/documents/A5-82_Antho_breton_3_texts_-_64_MARKIZ.txt
A212_13-403-06	N'em eus ket soñj , se 'zo sklaer , marteze zoken ne selaouis ket .	N’em eus ket soñj, se ‘zo sklaer, marteze zoken ne selaouis ket.	# nem øs ket sõ:ʃ # zo sklɛ:r # mar.'te.ze 'zo.ken ne se.'lɔ.wis ket #	1	1	0	session_2/text/documents/A5-82_Antho_breton_3_texts_-_64_MARKIZ.txt
A212_13-404-00	An deiz war-lerc'h , setu mamm , va moereb ,	An deiz war-lerc’h, setu mamm, va moereb, 	# ɑ̃n dɛjs 'war.lɛrx # 'se.ty mɑ̃m # va 'mwe.rɛp #	1	1	0	session_2/text/documents/A5-82_Antho_breton_3_texts_-_64_MARKIZ.txt
A212_13-404-01	he mab Jañig Trividig ha me , oc'h erruoud beure-mat en ti-forn .	he mab Jañig Trividig ha me, oc’h erruoud beure-mat en ti-forn. 	# e mɑ:p 'ʒɑ̃.ik tri.'vi.dig a me: # ɔh ɛ.'ry.ud bœ.'re.mad en 'ti.fɔrn #	1	1	0	session_2/text/documents/A5-82_Antho_breton_3_texts_-_64_MARKIZ.txt
A212_13-404-02	Stag ha prest e oa Markiz … Ha ne voen ket an hini diwezhañ o lammat er wetur !	Stag ha prest e oa Markiz... Ha ne voen ket an hini diwezhañ o lammat er wetur ! 	# stɑ:k a presd e wa 'mar.kis # a ne vwen ked ɑ̃n 'hi.ni di.'we.zɑ̃ o 'lɑ̃.mad er 'we.tyr #	1	1	0	session_2/text/documents/A5-82_Antho_breton_3_texts_-_64_MARKIZ.txt
A212_13-404-03	Evel bep gwech , stad a oa ennon , evel just , o vont d'ar Roc'h ,	Evel bep gwech, stad a oa ennon, evel just, o vont d’ar Roc’h, 	# 'e.vɛl bep gweʃ # stɑ:d a wa 'ɛ.nõn # 'e.vɛl ʒyst # o võn dar rɔx #	1	1	0	session_2/text/documents/A5-82_Antho_breton_3_texts_-_64_MARKIZ.txt
A212_13-404-04	met kemend-all a lorc'h o lakaat va revr e charbañ bihan ha koant ar bouloñjer .	met kemend-all a lorc’h o lakaat va revr e charbañ bihan ha koant ar bouloñjer.	# mɛt ke.'mɛn.dal a lɔrh o 'la.kɑt va rɛwr e 'ʃar.bɑ̃ 'bi.ɑ̃n a kwɑ̃nd ar bu.'lõ.ʒɛr #	1	1	0	session_2/text/documents/A5-82_Antho_breton_3_texts_-_64_MARKIZ.txt
A212_13-405	Va zintin , sonn evel ur pipi , he doa tapet krog er rañjennoù hag er skourjez .	Va zintin, sonn evel ur pipi, he doa tapet krog er rañjennoù hag er skourjez.	# va 'zin.tin # sõn 'e.vɛl œr 'pi.pi # e dwa 'ta.pɛt kro:g er rɑ̃.'ʒɛ.nu ag er 'skur.ʒɛs #	1	1	0	session_2/text/documents/A5-82_Antho_breton_3_texts_-_64_MARKIZ.txt
A212_13-406	« Hei ! »	« Hei ! »	# hɛj #	1	1	0	session_2/text/documents/A5-82_Antho_breton_3_texts_-_64_MARKIZ.txt
A212_13-407-00	Kuitaat a reas Markiz ar bourk buan ,	Kuitaat a reas Markiz ar bourk buan, 	# 'kɥi.tɑd a 're.as 'mar.kiz ar burg 'by.ɑ̃n #	1	1	0	session_2/text/documents/A5-82_Antho_breton_3_texts_-_64_MARKIZ.txt
A212_13-407-01	hag hep ardoù ,	hag hep ardoù, 	# ag heb 'ar.du #	1	1	0	session_2/text/documents/A5-82_Antho_breton_3_texts_-_64_MARKIZ.txt
A212_13-407-02	ne oa nemet lezel anezhañ da vont , ha Titich a gave anezhañ aes da vleniañ .	ne oa nemet lezel anezhañ da vont ha Titich a gave anezhañ aes da vleniañ. 	# ne wa 'ne.met 'le.zɛl ɑ̃.'ne.zɑ̃ dɑ võnt # a 'ti.tiʃ a 'ga.ve ɑ̃.'ne.zɑ̃ ɛ:s dɑ 'vle.njɑ̃ #	1	1	0	session_2/text/documents/A5-82_Antho_breton_3_texts_-_64_MARKIZ.txt
A212_13-407-03	Met ne ganas ket pell war an ton-se : 	Met ne ganas ket pell war an ton-se : 	# mɛt ne 'gɑ̃.nas ket pɛl war ɑ̃n 'tõn.se #	1	1	0	session_2/text/documents/A5-82_Antho_breton_3_texts_-_64_MARKIZ.txt
A212_13-407-04	pemp kant metr bennak pelloc'h ,	pemp kant metr bennak pelloc’h, 	# pɛm kɑ̃n mɛt 'bɛ.nak 'pɛ.lɔx #	1	1	0	session_2/text/documents/A5-82_Antho_breton_3_texts_-_64_MARKIZ.txt
A212_13-407-05	setu al loen o poz dirak un ti , ha ret skourjezañ anezhañ evit ober dezhañ derc'hel da vont . 	setu al loen o poz dirak un ti ha ret skourjezañ anezhañ evit ober dezhañ derc’hel da vont. 	# 'se.ty al lwẽ:n o po:s 'di.rag œn ti: # a ret skur.'ʒe.zɑ̃ ɑ̃.'ne.zɑ̃ 'e.vid 'o.bɛr 'de.zɑ̃ 'dɛrh.ɛl dɑ võnt #	1	1	0	session_2/text/documents/A5-82_Antho_breton_3_texts_-_64_MARKIZ.txt
A212_13-407-06	Dirak un eil ti , memes tra .	Dirak un eil ti, memes tra. 	# 'di.rag œn ɛjl ti: # 'me.mɛs trɑ: #	1	1	0	session_2/text/documents/A5-82_Antho_breton_3_texts_-_64_MARKIZ.txt
A212_13-407-07	E Koatilouri , he doe ar vlenierez kalz a boan o herzel outañ da vont el leur .	E Koatilouri, he doe ar vlenierez kalz a boan o herzel outañ da vont el leur. 	# e kwa.'ti.lurj # e 'do.e ar vle.'nje.rɛs kalz a bwɑ̃:n o 'hɛr.zɛl 'u.tɑ̃ dɑ võnd el lø:r #	1	1	0	session_2/text/documents/A5-82_Antho_breton_3_texts_-_64_MARKIZ.txt
A212_13-407-08	Kompren a-walc'h a rejomp , e oa kustum ar pabor da zegas bara d'an tiez-se .	Kompren a-walc’h a rejomp, e oa kustum ar pabor da zegas bara d’an tiez-se. 	# 'kõm.prɛn 'a.walh a 're.ʒõmp # e wa 'ky.stym ar 'pɑ.bɔr dɑ 'zeg.as 'bɑ.ra dɑ̃n 'ti.ez.se #	1	1	0	session_2/text/documents/A5-82_Antho_breton_3_texts_-_64_MARKIZ.txt
A212_13-407-09	Diskenn a reas d'an drot krav Kervarker ,	Diskenn a reas d’an drot krav Kervarker, 	# 'di.skɛn a 're.as dɑ̃n drɔt kraw kɛr.'var.kɛr #	1	1	0	session_2/text/documents/A5-82_Antho_breton_3_texts_-_64_MARKIZ.txt
A212_13-407-10	met degouezhet dirak ar menaj , 	met degouezhet dirak ar menaj, 	# mɛt de.'gwe.zɛt 'di.rag ar 'me.naʃ #	1	1	0	session_2/text/documents/A5-82_Antho_breton_3_texts_-_64_MARKIZ.txt
A212_13-407-11	e troas ken trumm evit mont er porzh , ken e voe darbet dimp bezañ darc'haouet e-maez .	e troas ken trumm evit mont er porzh, ken e voe darbet dimp bezañ darc’haouet e-maez. 	# e trwas ken trym 'e.vit mõnd er pɔrs # ken e vwe: 'dar.bɛt dim 'be.zɑ̃ darx.'ɔ.wɛd 'e.mɛs #	1	1	0	session_2/text/documents/A5-82_Antho_breton_3_texts_-_64_MARKIZ.txt
A212_13-407-12	Mamm a oa aet livet fall , ha Janig en doa kroget en he brec'h en ur ouelañ .	Mamm a oa aet livet fall, ha Jañig en doa kroget en he brec’h en ur ouelañ. 	# mɑ̃m a wa ɛ:t 'li.vɛt fal # a 'ʒɑ̃.nig en dwa 'krog.ɛd en e breh en œr 'we.lɑ̃ #	1	1	0	session_2/text/documents/A5-82_Antho_breton_3_texts_-_64_MARKIZ.txt
A212_13-407-13	Me a sache war ar rañjennoù gant Titich , ha dont a rejomp a-benn da addegas ar c'harr war an hent :	Me a sache war ar rañjennoù gant Titich, ha dont a rejomp a-benn da addegas ar c’harr war an hent : 	# me: a 'saʃ.e war ar rɑ̃.'ʒɛ.nu gɑ̃n 'ti.tiʃ # a dõnd a 're.ʒõmb 'a.bɛn dɑ ad.'deg.az ar xar war ɑ̃n hɛnt #	1	1	0	session_2/text/documents/A5-82_Antho_breton_3_texts_-_64_MARKIZ.txt
A212_13-407-14	 « Souz 'ta , loen vil ! »…	« Souz ‘ta, loen vil ! » ...	# tɑ # lwẽ:n vi:l #	1	1	0	session_2/text/documents/A5-82_Antho_breton_3_texts_-_64_MARKIZ.txt
A212_13-408	mil nav c'hant pemzek ha tri-ugent	1975	# mil naw xɑ̃n 'pɛm.zeg a tri.'yg.ɛnt #	1	1	0	session_2/text/documents/A5-82_Antho_breton_3_texts_-_64_MARKIZ.txt
A212_13-409	( Al liamm , niverenn kant nav ha tri-ugent )	(AL LIAMM n. 169)	# al ljɑ̃m # ni.'ve.rɛn kɑ̃n naw a tri.'yg.ɛnt #	1	1	0	session_2/text/documents/A5-82_Antho_breton_3_texts_-_64_MARKIZ.txt
A212_13-500	Youenn Olier	YOUENN OLIER	# 'ju.ɛn o.'li.ɛr #	1	1	0	session_2/texts/documents/10_Antho_breton_3_texts_-_16_ENEZ_AR_VERTUZ_AN_DISTRO_D_AR_G_R.txt
A212_13-501	Enez ar vertuz ( an distro d'ar gêr )	ENEZ AR VERTUZ (AN DISTRO D’AR GÊR)	# 'e.nɛz ar 'vɛr.tys # ɑ̃n 'di.stro dar gɛr #	1	1	0	session_2/texts/documents/10_Antho_breton_3_texts_-_16_ENEZ_AR_VERTUZ_AN_DISTRO_D_AR_G_R.txt
A212_13-502-00	Graet e oa bet va frosez e deroù miz Mezheven .	Graet e oa bet va frosez e deroù miz Mezheven. 	# grɛ:d e wa bet va 'fro.sɛz e 'de.ru mi:s me.'ze.vɛn #	1	1	0	session_2/texts/documents/10_Antho_breton_3_texts_-_16_ENEZ_AR_VERTUZ_AN_DISTRO_D_AR_G_R.txt
A212_13-502-01	Didamallet e voen dreist-holl , a-drugarez d'am zad-kaer , a dizhas diskouez d'ar varnerion e oa bet gwall-horjellet va yec'hed , abaoe ma oan erru el Ledenez . 	Didamallet e voen dreist-holl a-drugarez d’am zad-kaer a dizhas diskouez d’ar varnerion e oa bet gwall-horjellet va yec’hed abaoe ma oan erru el Ledenez. 	# di.dɑ̃.'ma.lɛd e vwen 'drɛj.stɔl # a.dryg.'ɑ.rɛs dɑ̃m 'zad.kɛr # a 'di.zaz 'di.skwɛs dar var.'ner.jõn e wa bet gwɑlh.ɔr.'ʒɛ.lɛd va 'jeh.ɛt # a.'bɔ.we ma wɑ̃:n 'ɛ.ry el le.'de.nɛs #	1	1	0	session_2/texts/documents/10_Antho_breton_3_texts_-_16_ENEZ_AR_VERTUZ_AN_DISTRO_D_AR_G_R.txt
A212_13-502-02	A-hend-all , daoust d'ar pezh a ziskreden , n'em boa graet nemet gloazañ an den am boa taget ;	A-hend-all, daoust d’ar pezh a ziskreden, n’em boa graet nemet gloazañ an den am boa taget ; 	# ah.'ɛn.dal # dɔwst dar pe:z a zi.'skre.dɛn # nem 'bo.a grɛ:t 'ne.met 'glwɑ.zɑ̃ ɑ̃n de:n ɑ̃m 'bo.a 'tɑg.ɛt #	1	1	0	session_2/texts/documents/10_Antho_breton_3_texts_-_16_ENEZ_AR_VERTUZ_AN_DISTRO_D_AR_G_R.txt
A212_13-502-03	pareet e oa a-benn neuze .	pareet e oa a-benn neuze. 	# pa.'re.ɛd e wa 'a.bɛn 'nø.ze #	1	1	0	session_2/texts/documents/10_Antho_breton_3_texts_-_16_ENEZ_AR_VERTUZ_AN_DISTRO_D_AR_G_R.txt
A212_13-502-04	War wall ur barrad diskiantegezh , e voe lakaet va gwall-daol e Brewenn . 	War wall ur barrad diskiantegezh, e voe lakaet va gwall-daol e Brewenn. 	# war wal œr 'ba.rat di.ski.ɑ̃n.'tɛg.ɛs # e vwe: 'la.kɛt va 'gwɑl.dɔl e 'bre.wɛn #	1	1	0	session_2/texts/documents/10_Antho_breton_3_texts_-_16_ENEZ_AR_VERTUZ_AN_DISTRO_D_AR_G_R.txt
A212_13-502-05	E-giz m'em eus lavaret deoc'h ivez ,	E-giz m’em eus lavaret deoc’h ivez, 	# 'eg.is mem øs la.'vɑ.rɛt 'de.ɔh 'i.ves #	1	1	0	session_2/texts/documents/10_Antho_breton_3_texts_-_16_ENEZ_AR_VERTUZ_AN_DISTRO_D_AR_G_R.txt
A212_13-502-06	un den a levezon e oa tad Maria ,	un den a levezon e oa tad Maria, 	# œn de:n a le.'ve.zõn e wa tɑ:t ma.'ri.a #	1	1	0	session_2/texts/documents/10_Antho_breton_3_texts_-_16_ENEZ_AR_VERTUZ_AN_DISTRO_D_AR_G_R.txt
A212_13-502-07	brudet ha doujet ,	brudet ha doujet, 	# 'bry.dɛt a 'du.ʒɛt #	1	1	0	session_2/texts/documents/10_Antho_breton_3_texts_-_16_ENEZ_AR_VERTUZ_AN_DISTRO_D_AR_G_R.txt
A212_13-502-08	helavar tre ; 	helavar tre ; 	# he.'lɑ.var tre: #	1	1	0	session_2/texts/documents/10_Antho_breton_3_texts_-_16_ENEZ_AR_VERTUZ_AN_DISTRO_D_AR_G_R.txt
A212_13-502-09	kendrec'hiñ a ouezas ar varnerion ; 	kendrec’hiñ a ouezas ar varnerion ; 	# kɛn.'dreh.i a 'we.zaz ar var.'ner.jõn #	1	1	0	session_2/texts/documents/10_Antho_breton_3_texts_-_16_ENEZ_AR_VERTUZ_AN_DISTRO_D_AR_G_R.txt
A212_13-502-10	o fromañ a c'hellas ivez o tisplegañ pebezh poanioù em boa diwasket en ti-bac'h .	o fromañ a c’hellas ivez o tisplegañ pebezh poanioù em boa diwasket en ti-bac’h. 	# o 'frõ.mɑ̃ a 'xɛ.laz 'i.vez o ti.'spleg.ɑ̃ 'pe.bɛs 'pwɑ̃.nju ɛm 'bo.a di.'wa.skɛd en 'ti.bax #	1	1	0	session_2/texts/documents/10_Antho_breton_3_texts_-_16_ENEZ_AR_VERTUZ_AN_DISTRO_D_AR_G_R.txt
A212_13-502-11	Taeriñ spontus en doa graet o c'houzout pebezh emzalc'h en doa bet rener an ti-bac'h em c'heñver .	Taeriñ spontus en doa graet o c’houzout pebezh emzalc’h en doa bet rener an ti-bac’h em c’heñver. 	# 'tɛ.ri 'spõn.tyz en dwa grɛ:d o 'xu.sut 'pe.bez 'em.zalh en dwa bet 're.nɛr ɑ̃n 'ti.bah ɛm 'xẽ.vɛr #	1	1	0	session_2/texts/documents/10_Antho_breton_3_texts_-_16_ENEZ_AR_VERTUZ_AN_DISTRO_D_AR_G_R.txt
A212_13-502-12	Goulennet en doa groñs , e ve graet un enklask pizh , diwar-benn pezh a c'hoarveze en ti-bac'h-se .	Goulennet en doa groñs e ve graet un enklask pizh diwar-benn pezh a c’hoarveze en ti-bac’h-se. 	# gu.'lɛ.nɛd en dwa grõ:s # e ve: grɛ:d œn 'eŋ.klask pi:s # di.'war.bɛn pe:z a xwar.'ve.ze en 'ti.bax.se #	1	1	0	session_2/texts/documents/10_Antho_breton_3_texts_-_16_ENEZ_AR_VERTUZ_AN_DISTRO_D_AR_G_R.txt
A212_13-502-13	Pa voe bet embannet an danevellskrid , e voe dec'halvet ar rener dirak ur poellgor- reizhañ , ha dizornet diouzh e garg .	Pa voe bet embannet an danevellskrid e voe dec’halvet ar rener dirak ur poellgor- reizhañ ha dizornet diouzh e garg. 	# pa vwe: bed em.'bɑ̃.nɛd ɑ̃n dɑ̃.ne.'vɛl.skrit # e vwe: deh.'al.ved ar 're.nɛr 'di.rag œr po.'ɛlg.or 'rɛj.zɑ̃ # a di.'zɔr.nɛt djuz e gark #	1	1	0	session_2/texts/documents/10_Antho_breton_3_texts_-_16_ENEZ_AR_VERTUZ_AN_DISTRO_D_AR_G_R.txt
A212_13-502-14	Divizet e voe ouzhpenn , kempenn an ti-bac'h , ha gwellaat ar barnerezh el Ledenez dre vras .	Divizet e voe ouzhpenn kempenn an ti-bac’h ha gwellaat ar barnerezh el Ledenez dre vras. 	# di.'vi.zɛd e vwe: 'u.spɛn # 'kɛm.pɛn ɑ̃n 'ti.bax # a 'gwɛ.lɑd ar bar.'nɛ.rez el le.'de.nɛs dre vrɑ:s #	1	1	0	session_2/texts/documents/10_Antho_breton_3_texts_-_16_ENEZ_AR_VERTUZ_AN_DISTRO_D_AR_G_R.txt
A212_13-502-15	Evel-se , Morgan , ne voe ket didalvez va foanioù da vihanañ .	Evel-se, Morgan, ne voe ket didalvez va foanioù da vihanañ.	# 'e.vɛl.se # 'morg.ɑ̃n # ne vwe: ket di.'dal.vɛs va 'fwɑ̃.nju dɑ vih.'ɑ̃.nɑ̃ #	1	1	0	session_2/texts/documents/10_Antho_breton_3_texts_-_16_ENEZ_AR_VERTUZ_AN_DISTRO_D_AR_G_R.txt
A212_13-503-00	Me a oa diseblant kaer ouzh kement-se d'ar c'houlz-se .	Me a oa diseblant kaer ouzh kement-se d’ar c’houlz-se. 	# me: a wa di.'ze.blɑ̃n kɛ:r us 'ke.mɛn.se dar 'xulz.se #	1	1	0	session_2/texts/documents/10_Antho_breton_3_texts_-_16_ENEZ_AR_VERTUZ_AN_DISTRO_D_AR_G_R.txt
A212_13-503-01	Dinerzhet krenn e oan bet gant va bac'hidigezh ha blin meurbet e oan manet .	Dinerzhet krenn e oan bet gant va bac’hidigezh ha blin meurbet e oan manet. 	# di.'nɛr.sɛt krɛn e wɑ̃:n bet gɑ̃n va bah.i.'dig.ɛs a bli:n 'mœr.bed e wɑ̃:n 'mɑ̃.nɛt #	1	1	0	session_2/texts/documents/10_Antho_breton_3_texts_-_16_ENEZ_AR_VERTUZ_AN_DISTRO_D_AR_G_R.txt
A212_13-503-02	N'oan ket mui gouest d'en em chalañ na da gounnariñ , diviet ha ma oa va zrivlierezh .	N’oan ket mui gouest d’en em chalañ na da gounnariñ diviet ha ma oa va zrivlierezh. 	# nwɑ̃n ket mɥi: gwest den ɛm 'ʃɑ.lɑ̃ na dɑ gu.'nɑ.ri # 'di.vjɛt a ma wa va zriv.'ljɛ.rɛz #	1	1	0	session_2/texts/documents/10_Antho_breton_3_texts_-_16_ENEZ_AR_VERTUZ_AN_DISTRO_D_AR_G_R.txt
A212_13-503-03	A-benn diskuizhañ , e oan aet da dremen mizioù an hañv , en ur vourc'hadenn vihan war aod kreisteiz al Ledenez ,	A-benn diskuizhañ e oan aet da dremen mizioù an hañv en ur vourc’hadenn vihan war aod kreisteiz al Ledenez, 	# 'a.bɛn dis.'kɥi.zɑ̃ # e wɑ̃:n ɛ:t dɑ 'dre.mɛn 'mi.zju ɑ̃n hɑ̃: # en œr vurx.'ɑ.dɛn 'vih.ɑ̃n war ɔ:t 'krɛj.stɛjz al le.'de.nɛs #	1	1	0	session_2/texts/documents/10_Antho_breton_3_texts_-_16_ENEZ_AR_VERTUZ_AN_DISTRO_D_AR_G_R.txt
