A212_13-000	Jarl Priel	Jarl Priel	# ʒarl 'pri.jɛl #	1	1	0	session_2/text/documents/A1-05_Antho_breton_3_texts_-_03_GWELL_BEZAN_MAB_KRIZ_EGET_BELEG_FALL.txt
A212_13-107-00	Ne oa ket deuet d'e soñj war an taol .	Ne oa ket deuet d’e soñj war an taol. 	# ne wa ket dø:t de sõ:ʃ war ɑ̃n tɔ:l #	1	1	0	session_2/text/documents/A2-25_Antho_breton_3_texts_-_13_EN_DRAONIENN.txt
A212_13-107-01	Bremañ avat , ec'h adwele an nozvezh m'he devoa kontet se dezhañ .	Bremañ avat ec’h adwele an nozvezh m’he devoa kontet se dezhañ.	# 'bre.mɑ̃ 'a.vat # eh a.'dwe.le ɑ̃n 'noz.vez mhe 'de.vwa 'kõn.tɛt se 'de.zɑ̃ #	1	1	0	session_2/text/documents/A2-25_Antho_breton_3_texts_-_13_EN_DRAONIENN.txt
A212_13-108-00	E geniterv a rae anezhi daoust ma ne oant ket kar e doare ebet	E geniterv a rae anezhi daoust ma ne oant ket kar e doare ebet. 	# e ge.'ni.tɛrw a rɛ: ɑ̃.'ne.zi dɔwst ma ne wɑ̃n ket kar e 'dwɑ.re 'e.bet #	1	1	0	session_2/text/documents/A2-25_Antho_breton_3_texts_-_13_EN_DRAONIENN.txt
A212_13-108-01	He zad a oa addimezet gant ur voereb da Herve , hag en em gavet e oant meur a wech asambles ,	He zad a oa addimezet gant ur voereb da Herve hag en em gavet e oant meur a wech asambles, 	# e zɑd a wa a.ti.'me.zɛd gɑ̃n œr vo.'e.rɛp dɑ 'hɛr.ve # ag en ɛm 'ga.ved e wɑ̃n mø:r a weʃ a.'sɑ̃m.blɛs #	1	1	0	session_2/text/documents/A2-25_Antho_breton_3_texts_-_13_EN_DRAONIENN.txt
A212_13-108-02	da geñver un eured ,	da geñver un eured, 	# dɑ 'gẽ.vɛr œn 'ø.rɛt #	1	1	0	session_2/text/documents/A2-25_Antho_breton_3_texts_-_13_EN_DRAONIENN.txt
A212_13-108-03	ur vadeziant , pe da geñver Pask kentañ unan bennak anezho .	ur vadeziant pe da geñver Pask kentañ unan bennak anezho. 	# œr va.'de.zjɑ̃nt # pe dɑ 'gẽ.vɛr pask 'kɛn.tɑ̃ 'y.nɑ̃n 'bɛ.nag ɑ̃.'ne.zo #	1	1	0	session_2/text/documents/A2-25_Antho_breton_3_texts_-_13_EN_DRAONIENN.txt
A212_13-108-04	Daoust ha poket o doa an eil d'egile ?	Daoust ha poket o doa an eil d’egile ? 	# dɔwst a 'po.kɛd o dwa ɑ̃n ɛjl deg.'i.le #	1	1	0	session_2/text/documents/A2-25_Antho_breton_3_texts_-_13_EN_DRAONIENN.txt
A212_13-108-05	Marteze dirak an holl , a-raok en em zispartiañ , evel ma ra kendirvi .	Marteze dirak an holl, a-raok en em zispartiañ, evel ma ra kendirvi. 	# mar.'te.ze 'di.rag ɑ̃n ɔl # 'a.rɔg en ɛm zi.'spar.tjɑ̃ # 'e.vɛl ma ra kɛn.'dir.vi #	1	1	0	session_2/text/documents/A2-25_Antho_breton_3_texts_-_13_EN_DRAONIENN.txt
A212_13-108-06	Met soñj en devoa ivez bezañ kroget en he dorn , ha komzet e-pad pell ganti diouzh an noz .	Met soñj en devoa ivez bezañ kroget en he dorn, ha komzet e-pad pell ganti diouzh an noz. 	# mɛt sõ:ʃ en 'de.vwa 'i.ves 'be.zɑ̃ 'krog.ɛd en e dɔrn # a 'kõm.zɛd 'e.pɑt pɛl 'gɑ̃n.ti djuz ɑ̃n no:s #	1	1	0	session_2/text/documents/A2-25_Antho_breton_3_texts_-_13_EN_DRAONIENN.txt
A212_13-108-07	Tremenet en devoa zoken e vizied en he blev hir ,	Tremenet en devoa zoken e vizied en he blev hir, 	# tre.'me.nɛd en 'de.vwa 'zo.ken e vi.'zi.ɛd en e blɛw hi:r #	1	1	0	session_2/text/documents/A2-25_Antho_breton_3_texts_-_13_EN_DRAONIENN.txt
A212_13-108-08	 hogen hi he devoa tapet krog en e zorn hag e lamet gant douster .	hogen hi he devoa tapet krog en e zorn hag e lamet gant douster.	# 'og.ɛn hi: e 'de.vwa 'ta.pɛt kro:g en e zɔrn ag e 'lɑ̃.mɛt gɑ̃n 'du.stɛr #	1	1	0	session_2/text/documents/A2-25_Antho_breton_3_texts_-_13_EN_DRAONIENN.txt
A212_13-109-00	An tren bihan a derme er pellder .	An tren bihan a derme er pellder. 	# ɑ̃n trɛn 'bi.ɑ̃n a 'dɛr.me er 'pɛl.dɛr #	1	1	0	session_2/text/documents/A2-25_Antho_breton_3_texts_-_13_EN_DRAONIENN.txt
A212_13-109-01	Edo o tostaat ouzh gar Koadelan , hag e c'hwibanas en un doare truezus .	Edo o tostaat ouzh gar Koadelan hag e c’hwibanas en un doare truezus. 	# 'e.do o 'to.stɑd us ga:r kwa.'de.lɑ̃n # ag e xwi.'bɑ̃.naz en œn 'dwɑ.re try.'e.zys #	1	1	0	session_2/text/documents/A2-25_Antho_breton_3_texts_-_13_EN_DRAONIENN.txt
A212_13-109-02	Diskenn a reas Herve er prad .	Diskenn a reas Herve er prad. 	# 'di.skɛn a 're.as 'hɛr.ve er prɑ:t #	1	1	0	session_2/text/documents/A2-25_Antho_breton_3_texts_-_13_EN_DRAONIENN.txt
A212_13-109-03	Hep gouzout dezhañ e oa steuziet an heol a-drek gwez an dorgenn , ha deut e oa da vezañ fresk en draonienn .	Hep gouzout dezhañ e oa steuziet an heol a-drek gwez an dorgenn, ha deut e oa da vezañ fresk en draonienn.	# hep 'gu.zut 'de.zɑ̃ e wa 'stø.zjɛd ɑ̃n hɛwl 'a.dreg gwe:z ɑ̃n 'dɔrg.ɛn # a død e wa dɑ 've.zɑ̃ fresk en 'drɑ̃w.njɛn #	1	1	0	session_2/text/documents/A2-25_Antho_breton_3_texts_-_13_EN_DRAONIENN.txt
A212_13-110-00	Edo e vagad saout o peuriñ sioul .	Edo e vagad saout o peuriñ sioul. 	# 'e.do e 'vɑg.at sɔwd o 'pø.ri siwl #	1	1	0	session_2/text/documents/A2-25_Antho_breton_3_texts_-_13_EN_DRAONIENN.txt
A212_13-110-01	Al loened n'o devoa ket treuzet ar stêr , ha ne oant ket aet da redek er c'hoad en tu all .	Al loened n’o devoa ket treuzet ar stêr, ha ne oant ket aet da redek er c’hoad en tu all. 	# al 'lwẽ.ned no 'de.vwa ket 'trø.zɛd ar stɛ:r # a ne wɑ̃n ked ɛ:t dɑ 're.dɛg er xwad en ty al #	1	1	0	session_2/text/documents/A2-25_Antho_breton_3_texts_-_13_EN_DRAONIENN.txt
A212_13-110-02	Tostaat a reas ouzh an dour a eonenne dreist ar vein .	Tostaat a reas ouzh an dour a eonenne dreist ar vein. 	# 'to.stɑd a 're.az uz ɑ̃n du:r a e.õ.'nɛ.ne drɛjsd ar vɛjn #	1	1	0	session_2/text/documents/A2-25_Antho_breton_3_texts_-_13_EN_DRAONIENN.txt
A212_13-110-03	Kresket e oa ha kreñvoc'h e oa ar red dre ma oa bet digoret ur bal bennak uheloc'h .	Kresket e oa ha kreñvoc’h e oa ar red dre ma oa bet digoret ur bal bennak uheloc’h. 	# 'kre.skɛd e wa a 'krẽ.vɔh e wa ar re:t dre ma wa bet dig.'o.rɛd œr bɑ:l 'bɛ.nag y.'e.lɔx #	1	1	0	session_2/text/documents/A2-25_Antho_breton_3_texts_-_13_EN_DRAONIENN.txt
A212_13-110-04	Ar vilin vihan , kouezhet war he c'hostez , ne droe ket ken .	Ar vilin vihan, kouezhet war he c’hostez, ne droe ket ken.	# ar 'vi.lin 'vih.ɑ̃n # 'kwe.zɛd war e 'xɔ.stɛs # ne 'dro.e ket ken #	1	1	0	session_2/text/documents/A2-25_Antho_breton_3_texts_-_13_EN_DRAONIENN.txt
A212_13-111-00	Dilezel a reas Herve e vilin hag e c'hoari .	Dilezel a reas Herve e vilin hag e c’hoari. 	# di.'le.zɛl a 're.as 'hɛr.ve e 'vi.lin ag e 'xwɑ.ri #	1	1	0	session_2/text/documents/A2-25_Antho_breton_3_texts_-_13_EN_DRAONIENN.txt
A212_13-111-01	Dastum a reas e vazh , hag en ur vont a-hed ar stêr , e tibenne a dro-jouez ar c'hegid o tiwanañ penn-da-benn .	Dastum a reas e vazh, hag en ur vont a-hed ar stêr, e tibenne a dro-jouez ar c’hegid o tiwanañ penn-da-benn.	# 'da.stym a 're.az e vɑ:s # ag en œr võnd 'ah.ed ar stɛ:r # e ti.'bɛ.ne a 'dro.ʒwɛz ar 'xeg.id o ti.'wɑ̃.nɑ̃ pɛn.'da.bɛn #	1	1	0	session_2/text/documents/A2-25_Antho_breton_3_texts_-_13_EN_DRAONIENN.txt
A212_13-112-00	Mont a reas betek korn ar prad e-lec'h ma tibouke ar stêr a-zindan pont an hent-houarn .	Mont a reas betek korn ar prad e-lec’h ma tibouke ar stêr a-zindan pont an hent-houarn. 	# mõnd a 're.as 'be.tek kɔrn ar prɑ:d 'e.lɛx ma ti.'bu.ke ar stɛ:r a.'zin.dɑ̃n põnd ɑ̃n hɛn.'tu.arn #	1	1	0	session_2/text/documents/A2-25_Antho_breton_3_texts_-_13_EN_DRAONIENN.txt
A212_13-112-01	Teñval e oa , dindan ar volz uhel , ha ret e oa gaoliata ul lamm-dour trouzus evit mont e-barzh .	Teñval e oa, dindan ar volz uhel, ha ret e oa gaoliata ul lamm-dour trouzus evit mont e-barzh. 	# 'tẽ.val e wa # 'din.dɑ̃n ar vɔlz 'y.ɛl # a red e wa gaw.'lja.ta œl 'lɑ̃m.dur 'tru.zyz 'e.vit mõnd 'e.bars #	1	1	0	session_2/text/documents/A2-25_Antho_breton_3_texts_-_13_EN_DRAONIENN.txt
A212_13-112-02	Eno , ne veze ket gwelet ar strad ,	Eno ne veze ket gwelet ar strad, 	# 'e.no # ne 've.ze ket 'gwe.lɛd ar strɑ:t #	1	1	0	session_2/text/documents/A2-25_Antho_breton_3_texts_-_13_EN_DRAONIENN.txt
A212_13-112-03	ha du e oa gorre an dour ma neuenne warnañ bouchadoù eon .	ha du e oa gorre an dour ma neuenne warnañ bouchadoù eon.	# a dy e wa 'gɔ.re ɑ̃n du:r ma nø.'ɛ.ne 'war.nɑ̃ buʃ.'ɑ.du 'e.õn #	1	1	0	session_2/text/documents/A2-25_Antho_breton_3_texts_-_13_EN_DRAONIENN.txt
A212_13-113-00	Klevet en devoa lavarout , e oa don al lec'h-se , hag ur bloavezh ,	Klevet en devoa lavarout e oa don al lec’h-se, hag ur bloavezh, 	# 'kle.vɛd en 'de.vwa la.'vɑ.rut # e wa dõ:n al 'lɛx.se # ag œr 'blwɑ.vɛs #	1	1	0	session_2/text/documents/A2-25_Antho_breton_3_texts_-_13_EN_DRAONIENN.txt
A212_13-113-01	p'edont oc'h echuiñ dastum ar foenn , o devoa ar baotred yaouank , sanket ur berchenn ennañ evit klask ar strad .	p’edont oc’h echuiñ dastum ar foenn, o devoa ar baotred yaouank, sanket ur berchenn ennañ evit klask ar strad.	# 'pe.dõnd ɔh eʃ.'y.i 'da.stym ar fwɛn # o 'de.vwa ar 'bɔ.trɛd 'jɔ.wɑ̃ŋk # 'sɑ̃ŋ.kɛd œr 'bɛrʃ.ɛn 'ɛ.nɑ̃ 'e.vit klask ar strɑ:t #	1	1	0	session_2/text/documents/A2-25_Antho_breton_3_texts_-_13_EN_DRAONIENN.txt
A212_13-114-00	Chom a reas ur pennadig da sellout ouzh an dour oc'h eonenniñ .	Chom a reas ur pennadig da sellout ouzh an dour oc’h eonenniñ. 	# ʃɔm a 're.az œr pɛ.'nɑ.dig dɑ 'sɛ.lud uz ɑ̃n du:r ɔh e.õ.'nɛ.ni #	1	1	0	session_2/text/documents/A2-25_Antho_breton_3_texts_-_13_EN_DRAONIENN.txt
A212_13-114-01	Adwelout a rae Karol , hec'h-unan e lost an tren , hag eñ , e-unan war vord al linenn-houarn .	Adwelout a rae Karol, hec’h-unan e lost an tren, hag eñ, e-unan war vord al linenn-houarn.	# a.'dwe.lud a rɛ: 'kɑ.rol # eh.'y.nɑ̃n e lɔsd ɑ̃n trɛn # ag ẽ # e.'y.nɑ̃n war vord al li.nɛ.'nu.arn #	1	1	0	session_2/text/documents/A2-25_Antho_breton_3_texts_-_13_EN_DRAONIENN.txt
A212_13-115-00	Paotred all eo a vefe dudiet gant he daoulagad ha flourder he blev gell e-pad ar vakañsoù-mañ .	Paotred all eo a vefe dudiet gant he daoulagad ha flourder he blev gell e-pad ar vakañsoù-mañ. 	# 'pɔ.trɛd al ɛw a 've.fe dy.'di.ɛt gɑ̃n e dɔw.'lɑg.at a 'flur.dɛr e blɛw gɛl 'e.pɑd ar va.'kɑ̃.su.mɑ̃ #	1	1	0	session_2/text/documents/A2-25_Antho_breton_3_texts_-_13_EN_DRAONIENN.txt
A212_13-115-01	Lezel a rafe marteze ur paotr all d'o flourañ en nozvezhioù-hañv , er vro-se dianav dezhañ .	Lezel a rafe marteze ur paotr all d’o flourañ en nozvezhioù-hañv, er vro-se dianav dezhañ.	# 'le.zɛl a 'ra.fe mar.'te.ze œr pɔtr al do 'flu.rɑ̃ en nɔz.ve.'zjuh.ɑ̃ # er 'vro.se di.'ɑ̃.naw 'de.zɑ̃ #	1	1	0	session_2/text/documents/A2-25_Antho_breton_3_texts_-_13_EN_DRAONIENN.txt
A212_13-116-00	Lemel a reas adarre e votoù , ha troñsañ e vragoù . 	Lemel a reas adarre e votoù, ha troñsañ e vragoù. 	# 'le.mɛl a 're.az a.'da.re e 'vɔ.tu # a 'trõ.sɑ̃ e 'vrɑg.u #	1	1	0	session_2/text/documents/A2-25_Antho_breton_3_texts_-_13_EN_DRAONIENN.txt
A212_13-116-01	E korn ar pont , e oa ul lec'h ma oa mac'het ar geot gant ar besketaerien , a dremene dre eno ,	E korn ar pont, e oa ul lec’h ma oa mac’het ar geot gant ar besketaerien, a dremene dre eno, 	# e kɔrn ar põnt # e wa œl lɛx ma wa 'mah.ɛd ar gɛwt gɑ̃n ar be.ske.'tɛr.jɛn # a dre.'me.ne dre 'e.no #	1	1	0	session_2/text/documents/A2-25_Antho_breton_3_texts_-_13_EN_DRAONIENN.txt
A212_13-116-02	kentoc'h eget sevel betek al linenn-houarn , ha diskenn en-dro da adkavout ar stêr .	kentoc’h eget sevel betek al linenn-houarn, ha diskenn en-dro da adkavout ar stêr. 	# 'kɛn.tɔh 'eg.et 'se.vɛl 'be.teg al li.nɛ.'nu.arn # a 'di.skɛn 'en.dro dɑ at.'kɑ.vud ar stɛ:r #	1	1	0	session_2/text/documents/A2-25_Antho_breton_3_texts_-_13_EN_DRAONIENN.txt
A212_13-116-03	Gaoliata a reas gant evezh ar c'horn a-us d'an dour o vourbouilhat , ha mont dindan ar pont .	Gaoliata a reas gant evezh ar c’horn a-us d’an dour o vourbouilhat, ha mont dindan ar pont.	# gaw.'lja.ta a 're.as gɑ̃n 'e.vez ar xɔrn 'a.ys dɑ̃n du:r o vur.'buʎ.at # a mõn 'din.dɑ̃n ar põnt #	1	1	0	session_2/text/documents/A2-25_Antho_breton_3_texts_-_13_EN_DRAONIENN.txt
A212_13-117-00	Fresk e oa en damdeñvalijenn .	Fresk e oa en damdeñvalijenn. 	# fresk e wa en dɑ̃m.dẽ.va.'li.ʒɛn #	1	1	0	session_2/text/documents/A2-25_Antho_breton_3_texts_-_13_EN_DRAONIENN.txt
A212_13-117-01	 E penn all ar pont , hanter kant metr bennak pelloc'h , e splanne ar geot ,	E penn all ar pont, hanter kant metr bennak pelloc’h, e splanne ar geot, 	# e pɛn al ar põnt # 'hɑ̃n.tɛr kɑ̃n mɛt 'bɛ.nak 'pɛ.lɔx # e 'splɑ̃.ne ar gɛwt #	1	1	0	session_2/text/documents/A2-25_Antho_breton_3_texts_-_13_EN_DRAONIENN.txt
A212_13-117-02	 glas-tener , dre ma pare c'hoazh an heol warni .	glas-tener, dre ma pare c’hoazh an heol warni. 	# glɑ.'ste.nɛr # dre ma 'pɑ.re xwaz ɑ̃n hɛwl 'war.ni #	1	1	0	session_2/text/documents/A2-25_Antho_breton_3_texts_-_13_EN_DRAONIENN.txt
A212_13-117-03	Kerzhout a reas betek kreiz ar volz war ar vein rust a rae droug d'e dreid .	Kerzhout a reas betek kreiz ar volz war ar vein rust a rae droug d’e dreid.	# 'kɛr.zud a 're.as 'be.tek krɛjz ar vɔls war ar vɛjn rysd a rɛ: druk de drɛjt #	1	1	0	session_2/text/documents/A2-25_Antho_breton_3_texts_-_13_EN_DRAONIENN.txt
A212_13-118-00	Sellout a reas ouzh an dent-genver , a-istribilh ouzh ar mein-benerezh a-us dezhañ ,	Sellout a reas ouzh an dent-genver, a-istribilh ouzh ar mein-benerezh a-us dezhañ, 	# 'sɛ.lud a 're.az uz ɑ̃n dɛng.'ɛn.vɛr # a.i.'stri.biʎ uz ar mɛjn.be.'nɛ.rez 'a.ys 'de.zɑ̃ #	1	1	0	session_2/text/documents/A2-25_Antho_breton_3_texts_-_13_EN_DRAONIENN.txt
A212_13-118-01	hag ez en em lakaas da huchal a-bouez-penn :	hag ez en em lakaas da huchal a-bouez-penn : 	# ag ez en ɛm la.'ka.az dɑ 'hyʃ.al a.'bwe.spɛn #	1	1	0	session_2/text/documents/A2-25_Antho_breton_3_texts_-_13_EN_DRAONIENN.txt
A212_13-118-02	« Karol ! » .	« Karol ! ». 	# 'kɑ.rol #	1	1	0	session_2/text/documents/A2-25_Antho_breton_3_texts_-_13_EN_DRAONIENN.txt
A212_13-118-03	An heklev a respontas : « Karo-ol ! »	An heklev a respontas : « Karo-ol ! » 	# ɑ̃n 'he.klɛw a rɛ.'spõn.tas # ka.'ro.ol #	1	1	0	session_2/text/documents/A2-25_Antho_breton_3_texts_-_13_EN_DRAONIENN.txt
A212_13-118-04	« Me ho kar ! »	« Me ho kar ! » 	# me: o kar #	1	1	0	session_2/text/documents/A2-25_Antho_breton_3_texts_-_13_EN_DRAONIENN.txt
A212_13-118-05	« Me ho ka-ar ! » .	« Me ho ka-ar ! ». 	# me: o 'ka.ar #	1	1	0	session_2/text/documents/A2-25_Antho_breton_3_texts_-_13_EN_DRAONIENN.txt
A212_13-118-06	Ar wech kentañ e oa dezhañ , lavarout seurt komzoù , ha den ebet d'e glevout .	Ar wech kentañ e oa dezhañ, lavarout seurt komzoù ha den ebet d’e glevout.	# ar weʃ 'kɛn.tɑ̃ e wa 'de.zɑ̃ # la.'vɑ.rut sœrt 'kõm.zu # a de:n 'e.bet de 'gle.vut #	1	1	0	session_2/text/documents/A2-25_Antho_breton_3_texts_-_13_EN_DRAONIENN.txt
A212_13-119-00	Pa zistroas er prad edo unan eus ar saout o kregiñ da bignat .	Pa zistroas er prad edo unan eus ar saout o kregiñ da bignat. 	# pa 'zis.trwaz er prɑ:d 'e.do 'y.nɑ̃n øz ar sɔwd o 'kreg.i dɑ 'biɲ.at #	1	1	0	session_2/text/documents/A2-25_Antho_breton_3_texts_-_13_EN_DRAONIENN.txt
A212_13-119-01	Echu he c'hofad ganti edo o vont etrezek ar gêr .	Echu he c’hofad ganti edo o vont etrezek ar gêr.	# 'eʃ.y e 'xo.fɑd 'gɑ̃n.ti 'e.do o võnd e.'tre.zɛg ar gɛr #	1	1	0	session_2/text/documents/A2-25_Antho_breton_3_texts_-_13_EN_DRAONIENN.txt
A212_13-120-00	Lakaat a reas Herve e dreid gleb en e votoù ha dastum al levr n'en devoa ket digoret .	Lakaat a reas Herve e dreid gleb en e votoù ha dastum al levr n’en devoa ket digoret. 	# 'la.kɑd a 're.as 'hɛr.ve e drɛjt gle:p en e 'vɔ.tu a 'da.stym al lɛwr nen 'de.vwa ket dig.'o.rɛt #	1	1	0	session_2/text/documents/A2-25_Antho_breton_3_texts_-_13_EN_DRAONIENN.txt
A212_13-120-01	Div vuoc'h a zalc'he da beuriñ sioul en e gichen .	Div vuoc’h a zalc’he da beuriñ sioul en e gichen. 	# diw 'vy.ɔh a 'zalh.e dɑ 'bø.ri siwl en e 'giʃ.ɛn #	1	1	0	session_2/text/documents/A2-25_Antho_breton_3_texts_-_13_EN_DRAONIENN.txt
A212_13-120-02	Kregiñ a reas en e vazh hag en em lakaas da skeiñ gant e holl nerzh warno .	Kregiñ a reas en e vazh hag en em lakaas da skeiñ gant e holl nerzh warno.	# 'kreg.i a 're.az en e vɑ:s ag en ɛm la.'ka.az dɑ skɛj gɑ̃n e ɔl nɛrs 'war.no #	1	1	0	session_2/text/documents/A2-25_Antho_breton_3_texts_-_13_EN_DRAONIENN.txt
A212_13-121	mil nav c'hant pevar ugent	1980	# mil naw xɑ̃n 'pe.var 'yg.ɛnt #	1	1	0	session_2/text/documents/A2-25_Antho_breton_3_texts_-_13_EN_DRAONIENN.txt
A212_13-200	Franseza Kervendal	Franseza Kervendal	# frɑ̃n.'se.za kɛr.'vɛn.dɑl #	1	1	0	session_2/text/documents/A3-68_Antho_breton_3_texts_-_50_MAMMOU_KOZH_DIWAN.txt
A212_13-201	Mammoù-kozh " Diwan "	Mammoù-kozh "Diwan"	# mɑ̃.'mu.kos # 'di.wɑ̃n #	1	1	0	session_2/text/documents/A3-68_Antho_breton_3_texts_-_50_MAMMOU_KOZH_DIWAN.txt
A212_13-202	pajenn tregont	p. 30	# 'pɑ.ʒɛn 'treg.õnt #	1	1	0	session_2/text/documents/A3-68_Antho_breton_3_texts_-_50_MAMMOU_KOZH_DIWAN.txt
A212_13-203-00	Pet oa ac'hanomp 'ta , merc'hed ? Pet ?	Pet oa ac’hanomp ‘ta, merc’hed ? Pet ? 	# ped wa tɑ # 'mɛrx.ɛt # pet #	1	1	0	session_2/text/documents/A3-68_Antho_breton_3_texts_-_50_MAMMOU_KOZH_DIWAN.txt
A212_13-203-01	O vezañ dibabet bevañ hor buhez pemdeziek - hini hon tiegezhioù -	O vezañ dibabet bevañ hor buhez pemdeziek – hini hon tiegezhioù – 	# o 've.zɑ̃ di.'bɑ.bɛd 'be.vɑ̃ ɔr 'by.ɛs pɛm.'de.zjɛk # 'hi.ni õn ti.eg.'ɛ.zju #	1	1	0	session_2/text/documents/A3-68_Antho_breton_3_texts_-_50_MAMMOU_KOZH_DIWAN.txt
A212_13-203-02	 ha desevel hor bugale dre , hag e brezhoneg nemetken ?	ha desevel hor bugale dre, hag e brezhoneg nemetken ? 	# a de.'se.vɛl ɔr byg.'ɑ.le dre # ag e bre.'zõ.nɛk ne.'met.ken #	1	1	0	session_2/text/documents/A3-68_Antho_breton_3_texts_-_50_MAMMOU_KOZH_DIWAN.txt
A212_13-203-03	Ya . Pet adalek ar bloavezh mil nav c'hant eizh ha daou ugent betek bremañ ?	Ya. Pet adalek ar bloavezh 1948 betek bremañ ? 	# ja # ped a.'dɑ.lɛg ar 'blwɑ.vez mil naw xɑ̃nd ɛjs a dɔw 'yg.ɛn 'be.teg 'bre.mɑ̃ #	1	1	0	session_2/text/documents/A3-68_Antho_breton_3_texts_-_50_MAMMOU_KOZH_DIWAN.txt
A212_13-203-04	Merc'hed , eus mil nav c'hant eizh ha daou ugent da mil nav c'hant tri ugent , daoust hag e oamp div zousennad ?	Merc’hed, eus 1948 da 1960, daoust hag e oamp div zousennad ? 	# 'mɛrx.ɛt # øs mil naw xɑ̃nd ɛjs a dɔw 'yg.ɛn dɑ mil naw xɑ̃n tri: 'yg.ɛnt # dɔwst ag e wɑ̃m diw zu.'sɛ.nɑt #	1	1	0	session_2/text/documents/A3-68_Antho_breton_3_texts_-_50_MAMMOU_KOZH_DIWAN.txt
A212_13-203-05	Rak , goude tanfoeltr an eil brezel bed , piv bennak , 	Rak, goude tanfoeltr an eil brezel bed, piv bennak, 	# rak # 'gu.de 'tɑ̃.fwɛltr ɑ̃n ɛjl 'bre.zɛl be:t # piw 'bɛ.nak #	1	1	0	session_2/text/documents/A3-68_Antho_breton_3_texts_-_50_MAMMOU_KOZH_DIWAN.txt
A212_13-203-06	dezhañ un disterig skiant-vat , en defe kredet ober seurt dibab ?	dezhañ un disterig skiant-vat, en defe kredet ober seurt dibab ?	# 'de.zɑ̃ œn di.'ste.rik ski.'ɑ̃n.vɑt # en 'de.fe 'kre.dɛd 'o.bɛr sœrt 'di.bap #	1	1	0	session_2/text/documents/A3-68_Antho_breton_3_texts_-_50_MAMMOU_KOZH_DIWAN.txt
A212_13-204-00	Seurt follentez oa bet dija araozomp .	Seurt follentez oa bet dija araozomp. 	# sœrt fɔ.'lɛn.tɛz wa bet 'di.ʒɑ a.'rɔ.zõmp #	1	1	0	session_2/text/documents/A3-68_Antho_breton_3_texts_-_50_MAMMOU_KOZH_DIWAN.txt
A212_13-204-01	Bugale oa bet savet en hor yezh e tiegezhioù brogar a-raok an eil brezel-mañ , met ni avat !	Bugale oa bet savet en hor yezh e tiegezhioù brogar a-raok an eil brezel-mañ, met ni avat !!! 	# byg.'ɑ.le wa bet 'sɑ.vɛd en ɔr je:z e ti.eg.'ɛ.zju 'brog.ar 'a.rɔg ɑ̃n ɛjl 'bre.zel.mɑ̃ # mɛt ni: 'a.vat #	1	1	0	session_2/text/documents/A3-68_Antho_breton_3_texts_-_50_MAMMOU_KOZH_DIWAN.txt
A212_13-204-02	Ret oa bezañ un tammig « direnket » kazi sur .	Ret oa bezañ un tammig « direnket » kazi sur. 	# red wa 'be.zɑ̃ œn 'tɑ̃.mik # di.'rẽŋ.kɛt # 'kɑ.zi sy:r #	1	1	0	session_2/text/documents/A3-68_Antho_breton_3_texts_-_50_MAMMOU_KOZH_DIWAN.txt
A212_13-204-03	Ni , pell an eil eus eben , hag evit lod en harlu ken pell , int , eus ar vro .	Ni, pell an eil eus eben, hag evit lod en harlu ken pell, int, eus ar vro. 	# ni: # pɛl ɑ̃n ɛjl øz 'e.ben # ag 'e.vit lo:d en 'ar.ly ken pɛl # int # øz ar vro #	1	1	0	session_2/text/documents/A3-68_Antho_breton_3_texts_-_50_MAMMOU_KOZH_DIWAN.txt
A212_13-204-04	Ne oa tu d'hor bugale d'en em welout nemet er c'hampoù hañv , evit ar re a c'helle dont !	Ne oa tu d’hor bugale d’en em welout nemet er c’hampoù hañv, evit ar re a c’helle dont !	# ne wa ty dhor byg.'ɑ.le den ɛm 'we.lud 'ne.med er 'xɑ̃m.pu hɑ̃: # 'e.vid ar re: a 'xɛ.le dõnt #	1	1	0	session_2/text/documents/A3-68_Antho_breton_3_texts_-_50_MAMMOU_KOZH_DIWAN.txt
A212_13-205-00	Klevet am eus distagañ dirazon un deiz , ur frazenn he deus sanket ur pistig melkonius em c'halon .	Klevet am eus distagañ dirazon un deiz, ur frazenn he deus sanket ur pistig melkonius em c’halon. 	# 'kle.vɛd ɑ̃m øs di.'stɑg.ɑ̃ di.'rɑ.zõn œn dɛjs # œr 'frɑ.zɛn e døs 'sɑ̃ŋ.kɛd œr 'pi.stik mɛl.kõ.'ni.yz ɛm 'xɑ.lõn #	1	1	0	session_2/text/documents/A3-68_Antho_breton_3_texts_-_50_MAMMOU_KOZH_DIWAN.txt
A212_13-205-01	« Petra hoc'h eus graet c'hwi ( ni ) evit ar brezhoneg ? » 	« Petra hoc’h eus graet c’hwi (ni) evit ar brezhoneg ? » 	# 'pe.tra oh øs grɛ:t xwi: # ni: # 'e.vid ar bre.'zõ.nɛk #	1	1	0	session_2/text/documents/A3-68_Antho_breton_3_texts_-_50_MAMMOU_KOZH_DIWAN.txt
A212_13-205-02	O prederiañ war se e soñjis : « Goude holl , re wir eo .	O prederiañ war se e soñjis : « Goude holl, re wir eo. 	# o pre.'der.jɑ̃ war se e 'sõ.ʒis # 'gu.de ɔl # re: wi:r ɛw #	1	1	0	session_2/text/documents/A3-68_Antho_breton_3_texts_-_50_MAMMOU_KOZH_DIWAN.txt
A212_13-205-03	N'hon eus graet netra tout nemet … bevañ ar brezhoneg . »	N’hon eus graet netra tout nemet... bevañ ar brezhoneg. » 	# nhõn øs grɛ:t 'ne.trɑ tut 'ne.met # 'be.vɑ̃ ar bre.'zõ.nɛk #	1	1	0	session_2/text/documents/A3-68_Antho_breton_3_texts_-_50_MAMMOU_KOZH_DIWAN.txt
A212_13-205-04	Met an dra-se hon eus ni , graet .	Met an dra-se hon eus, ni, graet. 	# mɛd ɑ̃n 'drɑ.se õn øs ni: # grɛ:t #	1	1	0	session_2/text/documents/A3-68_Antho_breton_3_texts_-_50_MAMMOU_KOZH_DIWAN.txt
A212_13-205-05	Ha va c'hredit , ret oa en ober ; hag ivez kaout youl daer , da badout d'en ober .	Ha va c’hredit, ret oa en ober ; hag ivez kaout youl daer, da badout d’en ober. 	# a va 'xre.dit # red wa en 'o.bɛr # ag 'i.ves kɔwd ju:l dɛ:r # dɑ 'bɑ.dut den 'o.bɛr #	1	1	0	session_2/text/documents/A3-68_Antho_breton_3_texts_-_50_MAMMOU_KOZH_DIWAN.txt
A212_13-205-06	Ur vuhez pemdeziek boutin gant trevelloù uvel .	Ur vuhez pemdeziek boutin gant trevelloù uvel. 	# œr 'vy.ɛs pɛm.'de.zjɛg 'bu.tin gɑ̃n tre.'vɛ.lu 'y.vɛl #	1	1	0	session_2/text/documents/A3-68_Antho_breton_3_texts_-_50_MAMMOU_KOZH_DIWAN.txt
A212_13-205-07	Kalet a-wechoù evit dont a-benn da sevel ni hon-unan ( an tiegezhioù ) 	Kalet a-wechoù evit dont a-benn da sevel ni hon-unan (an tiegezhioù) 	# 'kɑ.lɛd a.'weʃ.u 'e.vit dõnd 'a.bɛn dɑ 'se.vɛl ni: õ.'ny.nɑ̃n # ɑ̃n ti.eg.'ɛ.zju #	1	1	0	session_2/text/documents/A3-68_Antho_breton_3_texts_-_50_MAMMOU_KOZH_DIWAN.txt
A212_13-205-08	ar vrezhonegerien a-vihanik nemeto hiziv en hor bro .	ar vrezhonegerien a-vihanik nemeto hiziv en hor bro. 	# ar vre.zõ.neg.'er.jɛn a.vi.'ɑ̃.nig ne.'me.to 'hi.ziw en ɔr bro: #	1	1	0	session_2/text/documents/A3-68_Antho_breton_3_texts_-_50_MAMMOU_KOZH_DIWAN.txt
A212_13-205-09	Sur mat , a oad ganto , e kaver c'hoazh bugale ar mare-se o c'houzout brezhoneg .	Sur mat, a oad ganto, e kaver c’hoazh bugale ar mare-se o c’houzout brezhoneg. 	# sy:r mɑ:t # a wɑ:t 'gɑ̃n.to # e 'kɑ.vɛr xwas byg.'ɑ.le ar 'ma.re.se o 'xu.zud bre.'zõ.nɛk #	1	1	0	session_2/text/documents/A3-68_Antho_breton_3_texts_-_50_MAMMOU_KOZH_DIWAN.txt
A212_13-205-10	A drugarez Doue , met ne oant ket mui , allas !	A drugarez Doue, met ne oant ket mui, allas ! 	# a dryg.'ɑ.rɛs 'du.e # mɛt ne wɑ̃n ket mɥi: # 'a.las #	1	1	0	session_2/text/documents/A3-68_Antho_breton_3_texts_-_50_MAMMOU_KOZH_DIWAN.txt
A212_13-205-11	unyezhek …	unyezhek...	# y.'nje.zɛk #	1	1	0	session_2/text/documents/A3-68_Antho_breton_3_texts_-_50_MAMMOU_KOZH_DIWAN.txt
A212_13-206	mil nav c'hant c'hwec'h ha pevar ugent	1986	# mil naw xɑ̃n xwɛx a 'pe.var 'yg.ɛnt #	1	1	0	session_2/text/documents/A3-68_Antho_breton_3_texts_-_50_MAMMOU_KOZH_DIWAN.txt
A212_13-207	( Al liamm , niverenn daou c'hant eizh ha tregont , pajenn , daou c'hant tri ugent )	(AL LIAMM n. 238, p. 260)	# al ljɑ̃m # ni.'ve.rɛn dɔw xɑ̃nd ɛjs a 'treg.õnt # 'pɑ.ʒɛn # dɔw xɑ̃n tri: 'yg.ɛnt #	1	1	0	session_2/text/documents/A3-68_Antho_breton_3_texts_-_50_MAMMOU_KOZH_DIWAN.txt
A212_13-300	Vetig an Dret-Kervella	Vetig an Dret-Kervella	# 've.tig ɑ̃n dret.kɛr.'vɛ.la #	1	1	0	session_2/text/documents/A4-72_Antho_breton_3_texts_-_54_O_C_HARZHATA.txt
A212_13-301	O c'harzheta	O c'harzheta	# o xar.'se.ta #	1	1	0	session_2/text/documents/A4-72_Antho_breton_3_texts_-_54_O_C_HARZHATA.txt
A212_13-302	pajenn tri ha tregont	p. 33	# 'pɑ.ʒɛn tri: a 'treg.õnt #	1	1	0	session_2/text/documents/A4-72_Antho_breton_3_texts_-_54_O_C_HARZHATA.txt
A212_13-303-00	- Ma ! eme Vari ,	- Ma ! eme Vari, 	# ma # 'e.me 'vɑ.ri #	1	1	0	session_2/text/documents/A4-72_Antho_breton_3_texts_-_54_O_C_HARZHATA.txt
A212_13-303-01	 ro din ur pezh dek gwenneg hag ez ez da glevout muzik .	ro din ur pezh dek gwenneg hag ez ez da glevout muzik.	# ro: din œr pe:z deg 'gwɛ.nɛk ag ez es dɑ 'gle.vut 'my.zik #	1	1	0	session_2/text/documents/A4-72_Antho_breton_3_texts_-_54_O_C_HARZHATA.txt
A212_13-304-00	Boutet e voe ar pezh en ur faout ouzh kostez ar piano ,	Boutet e voe ar pezh en ur faout ouzh kostez ar piano, 	# 'bu.tɛd e vwe: ar pe:z en œr fɔwd us 'ko.stɛz ar pi.'ɑ.no #	1	1	0	session_2/text/documents/A4-72_Antho_breton_3_texts_-_54_O_C_HARZHATA.txt
